Date,Title,Description
2019-05-17,0,0
2019-05-17,"Bitcoin Drops $1,000 In Value Amid Market Sell-Off","Bitcoin has once again come into contact with a greater crypto market sell-off, slashing its price by more than $1000."
2019-05-17,Bitcoin Suffers Biggest Intraday Price Drop for Over a Year,"Amid extremely overbought conditions, bitcoin has fallen by $1,700 on Friday – its biggest intraday price drop since January 2018."
2019-05-17,Digital Renminbi: A Fiat Coin to Make M0 Great Again,"Anonymous, cryptocurrencies could become more important in an environment where government money is closely controlled, says Dovey Wan."
2019-05-17,Bitfinex Will List Its New Exchange Token Starting Monday,"Bitfinex will list its LEO exchange token on Monday, trading against bitcoin, ether, EOS, tether and the U.S. dollar."
2019-05-17,Amazon Wins Patent for Proof-of-Work Cryptographic System,Tech giant Amazon has been granted a patent for a proof-of-work (PoW) cryptographic system similar to those used by many blockchains.
2019-05-18,0,0
2019-05-18,About That Orange B... The History of Bitcoin’s Logos,Can a logo symbolize the ethos of a project? An industry? An entire movement? Bitcoin's might have come close.
2019-05-19,0,0
2019-05-19,Bitcoin and Blockchain: The Tangled History of Two Tech Buzzwords,"The word ""blockchain"" isn't used in the bitcoin white paper, the document that started it all. So, how did the term take off as a buzzword?"
2019-05-19,My Bank Account Was Frozen for Bitcoin – And It Only Made Me Love Crypto More,"The guy who coined the term ""hodl"" has a real bitcoin story that only made his interest in the technology stronger."
2019-05-20,0,0
2019-05-20,NYSE Arca Seeks Rule Change to List ETF Backed by Bitcoin and T-Bills,NYSE Arca has formally applied to the SEC for a rule change that would let it list shares in a proposed bitcoin trust.
2019-05-20,SEC Delays Decision on VanEck/SolidX Filing in Latest Bitcoin ETF Setback,The U.S. Securities and Exchange Commission (SEC) has again delayed a decision on a bitcoin exchange-traded fund (ETF) proposal.
2019-05-20,First Since 2017: Bitcoin Price Logs Double-Digit Gains for Third Week,Bitcoin has registered double digit gains for three consecutive weeks – a feat last seen at the height of the bull market in 2017.
2019-05-20,Coinbase Records Highest Weekly Ethereum Trading Volume Since 2017,"Popular ethereum markets exceeded $900 million in trading volume on Coinbase last week, its highest amount since late 2017."
2019-05-20,"ABN AMRO Eyes Launch of Blockchain Inventory Platform, Dropping Wallet Plan","As ABN AMRO drops its exploration of a crypto wallet product, the Dutch bank says it's seeking to launch a blockchain platform for trade inventory."
2019-05-21,0,0
2019-05-21,Bitcoin SV Surges 200% as Wright Registers Copyright to Satoshi White Paper,Bitcoin SV surged more than 200 percent on some exchanges after Craig Wright filed a copyright registration for the bitcoin white paper.
2019-05-21,Dutch Man Arrested Over $2.2 Million Bitcoin Mining Fraud,A man has been arrested in the Netherlands for allegedly scamming investors out of over $2.2 million in a fake bitcoin mining scheme.
2019-05-21,Craig Wright Attempts to Copyright the Satoshi White Paper and Bitcoin Code,Craig Wright has filed copyright registrations for the original Satoshi white paper and bitcoin code with the U.S. Copyright Office.
2019-05-21,Bitcoin’s Repeated Failures to Pass $8.3K Raise Risk of Price Pullback,"Bitcoin has failed three times in seven days to find acceptance above $8,300, raising the risk of a notable short-term correction."
2019-05-21,Craig Wright Is Playing Three-Dimensional Checkers,Craig Wrights efforts to copyright the Bitcoin archives are genius in a very special way.
2019-05-22,0,0
2019-05-22,Israeli Court Rules Bitcoin Is an Asset in Feud Over Tax Payment,"An Israeli court has ruled against an investor in declaring bitcoin is an asset and not a currency, and thus subject to capital gains tax."
2019-05-22,Traders Accused of Illegally Collecting $56 Million in Bitcoin for Loan Scheme,"Two OTC traders in China have been accused of illegally soliciting over 7,000 bitcoin in deposits for a supposed loan offering."
2019-05-22,EU Authorities Shut Down Bitcoin Transaction Mixer,A bitcoin transaction mixer has been seized and shut down by authorities in the European Union.
2019-05-22,Bitcoin Remains On the Defensive With Price Below $8K,"Bitcoin is teasing a downside break of its recent trading range, having again faced rejection above $8,000 today."
2019-05-22,US Copyright Office Says It Does Not ‘Recognize’ Craig Wright as Satoshi,"No, the U.S. government didn't officially recognize Craig Wright as Satoshi."
2019-05-23,0,0
2019-05-23,Swiss Watchmaker Franck Muller Launches 'Functional' Bitcoin Timepiece,Swiss luxury watchmaker Franck Muller has launched a limited-edition bitcoin timepiece dubbed “Encrypto” that comes with a cold wallet.
2019-05-23,Coinstar Expands Bitcoin Buying Service to Cover 21 US States,"Kiosk network Coinstar has expanded its bitcoin-buying service, adding around 100 new outlets and growing U.S. coverage to 21 states."
2019-05-23,Robinhood Opens Trading for 7 Cryptocurrencies in New York,"Five months after receiving a BitLicense, Robinhood is now offering ethereum and bitcoin trading in New York State."
2019-05-23,AT&T Teams With BitPay to Accept Bill Payments in Crypto,You can now pay your AT&T bill with crypto.
2019-05-23,Japan Scrutinizing Crypto Exchanges Ahead of G20 Summit,Japan’s financial watchdog is said to be inspecting crypto exchanges over anti-money laundering measures ahead of June's G20 meeting.
2019-05-24,0,0
2019-05-24,Bitcoin Cash Miners Undo Attacker's Transactions With '51% Attack',Two mining pools recently carried out a 51 percent attack on the bitcoin cash blockchain.
2019-05-24,Blockstream's Samson Mow Is Launching a Space Alien Gaming Token on Bitcoin,Bitcoin... in space? A company led by Blockstream CSO Samson Mow is looking to bridge the worlds of crypto and online gaming.
2019-05-24,LocalBitcoins Bans Bitcoin Buying in Iran in Blow to Rising Crypto Commerce,"Another crypto buying and selling service has banned Iranian users, pushing them toward anonymous decentralized exchanges."
2019-05-24,Long-Term Bitcoin Price Indicator Rises for First Time in a Year,"Bitcoin has moved back above $8,000 as a widely followed long-term indicator turns bullish for the first time in over a year."
2019-05-24,Lightning App for Sending Bitcoin Tips on Twitter Is Now Easier to Use,An app that lets you send lightning tips via Twitter just got a 1.0 software release with a set of new features.
2019-05-25,0,0
2019-05-25,"Crypto Funds, Lending and Market Manipulation","The growing practice of asset lending by crypto hedge funds could add systemic risk to the sector if we are not vigilant, argues Noelle Acheson."
2019-05-26,0,0
2019-05-26,What Will It Take to Regulate Crypto Exchanges?,"Regulation is needed to maintain neutrality among exchanges, but it might not be around the corner, argues Konstantinos Stylianou."
2019-05-26,Beacon Chain Contracts: A New Way to Deploy Dapps on Ethereum 2.0,A new proposal by founder of ethereum Vitalik Buterin suggests a new paradigm for decentralized application deployment on ethereum 2.0.
2019-05-27,0,0
2019-05-27,"Public Perceptions of the Bitcoin Spot Market Are Wrong, Says Bitwise","The bitcoin spot market is “significantly"" smaller and more efficient than is generally perceived, says a Bitwise paper sent as comment to the SEC."
2019-05-27,"Bitcoin Hits New 2019 High Above $8,900","Bitcoin's price has once again set a new high for 2019 after breaking out from a bullish pattern on the daily chart, reaching as high as $8,905."
2019-05-27,"Bitcoin Price Backs Off 12 Month Highs, But Bias Remains Bullish","Bitcoin has retreated from 12-month highs over $8,900 hit earlier today, but prices are holding well above key support at $8,390."
2019-05-27,Yahoo Japan-Backed Crypto Exchange Taotao Launches This Week,A new crypto exchange platform in which Yahoo Japan owns a major stake is about to launch after over a year in development.
2019-05-27,The Cat-and-Mouse Game of Crypto Regulation Enters a New Phase,"The cat-and-mouse game between regulators and crypto developers could spur a new era of innovation around the technology, writes Michael J. Casey."
2019-05-28,0,0
2019-05-28,Bitcoin Price Raises Bull Flag in Preparation for Possible Move Higher,Bitcoin has formed a technical pattern called a “bull flag” on the hourly chart – a pause that often refreshes higher.
2019-05-28,Korean Government Plans Action Over Risks of Resurgent Crypto Market,"With the price of bitcoin surging, the South Korean government has held an inter-agency emergency meeting over the risk for investors."
2019-05-28,Tezos Is About to Enact Its First-Ever On-Chain Blockchain Update,"For the past three months, users of the Tezos blockchain have been voting on a set of two upgrade proposals. Now, the Tezos blockchain is set to activate its first official sy..."
2019-05-28,Kik is Crowdfunding $5 Million in Crypto to Help Fight SEC,"Messaging app firm Kik has launched a crypto crowdfunding campaign to support a likely court battle with the U.S. SEC over its ICO token, kin."
2019-05-28,BitGo Co-Founder and Facebook Alum Joins Blockchain Capital,Crypto entrepreneur and investor Ben Davenport is joining Blockchain Capital as a venture partner.
2019-05-29,0,0
2019-05-29,Bitcoin's 'Toxic' Twitter 'Culture War' Explained,"A flare-up between developers, startup members and other members of the ecyostem around bitcoin raised a range of questions over the weekend."
2019-05-29,Bitcoin Price Eyes Longest Monthly Winning Run Since 2017,"Bitcoin is on track to register its longest winning streak since August 2017, with four consecutive months of price gains."
2019-05-29,Scammers Boost BSV Price With Fake Satoshi Confirmation,Scammers boosted the price of bitcoin SV with a fake news alert purporting to show BSV's creator is also bitcoin's.
2019-05-29,Associated Press Rules ‘Crypto’ Isn’t a Substitute for ‘Cryptocurrency’,"Cryptocurrency, bitcoin, and ethereum finally make it into the venerable AP Stylebook."
2019-05-29,Rakuten Brings in Compliance Partner for New Crypto Exchange,E-commerce giant Rakuten has partnered with blockchain analytics firm CipherTrace to ensure AML compliance for its soon-to-launch exchange platform.
2019-05-30,0,0
2019-05-30,Down $500 in Minutes: Bitcoin Rally Stalls As Price Rejected Above $9K,"Bitcoin's price pierced $9,000 earlier today for the first time in over a year but quickly retreated to price levels sub $8,600."
2019-05-30,China Authorities Probe Alleged Illegal Bitcoin Mining Sites at Hydro Plants,Authorities in Sichuan province are reportedly probing into local bitcoin mining farms that may have been constructed without official approval.
2019-05-30,Who Is Wei Liu? Second Copyright Filing Appears for Bitcoin White Paper,"Craig Wright now has a legal rival for claimed authorship of the bitcoin white paper, as a second registration is filed with the U.S. Copyright Office."
2019-05-30,'Everyone Can Be Satoshi': Liu Breaks Silence on Contest of Craig Wright's Bitcoin Copyright,Wei Liu says he registered a copyright on the Satoshi White Paper to show anyone can file for a copyright registration.
2019-05-30,Bitcoin Remains on Hunt for $9K After Defense of Key Price Support,"Bitcoin still has potential for a move to $9,000, having established a bullish pattern at key price support in the last 24 hours."
2019-05-31,0,0
2019-05-31,Bitcoin Shines Amid Wall Street Losses,"Bitcoin decoupled from traditional markets in the month of May, rising more than $3,000."
2019-05-31,Bitcoin Price Looks Poised for Pullback But June Could Revive Rally,Bitcoin is teasing a short-term bearish reversal at the onset of the historically strong month of June.
2019-05-31,Blockchain Adds PAX Stablecoin to Mobile Wallet,Crypto-wallet powerhouse Blockchain is adding a dollar-pegged stablecoin to attract more users.
2019-05-31,The Copyright for the Satoshi White Paper is Already Causing Trouble,Craig Wright's copyright registration of the Satoshi White Paper is causing some online services to censor the document.
2019-05-31,Coinbase Adds Support for EOS Cryptocurrency on Retail Site and Apps,Coinbase has added support for the EOS cryptocurrency for customers on Coinbase.com and its Android and iOS apps.
2019-06-01,0,0
2019-06-01,Bitcoin SV Was the Best Performing Crypto in May – And it Wasn't Close,"The cryptocurrency markets saw rapid growth in May, with quite a few tokens – including bitcoin SV – outshining bitcoin."
2019-06-01,"Who Has the Power, Retail or Institutional Investors?","The institutional and retail crypto markets are much more intertwined than we realize, argues Noelle Acheson, and each needs the other to hit scale."
2019-06-02,0,0
2019-06-02,"Maxwell, Wuille Co-Author Proposal for a Big Boost to Bitcoin's Bandwidth",A new paper outlines a proposed protocol that seeks to boost the bandwidth for bitcoin nodes.
2019-06-02,Can Bitcoin’s Lightning Network Power Payments in a Japanese Bar?,A bar in Japan is teaming up with a locally-based lightning startup to let customers pay using the experimental payments network.
2019-06-03,0,0
2019-06-03,Samourai Wallet Raises First Funding Round in Fight Against Bitcoin Surveillance,"The team behind the privacy-centric Samourai Wallet has received a $100,000 investment to expand its offerings."
2019-06-03,Open Bets On CME's Bitcoin Futures Hit Record High,"CME Bitcoin Futures have hit a record high in open interest at 5,190, up seven percent on the week prior, data from the CFTC shows."
2019-06-03,Why Bitcoin's 'Culture War' Matters,0
2019-06-03,Encrypted Email Service Launches on Blockstack With Bitcoin Features,An Egyptian web firm is building Dmail on Blockstack to bring bitcoin-friendly privacy tech to the Middle East.
2019-06-03,Bitcoin Faces Price Pullback as Signs of Bull Exhaustion Emerge,"Bitcoin could revisit sub-$8,000 levels in the short-term, as a longer-duration chart is flashing signs of bull exhaustion for the first time in 2019."
2019-06-04,0,0
2019-06-04,Bitcoin Dips Below $8K as Price Sheds $700 in Two Hours,"Bitcoin has once again fallen beneath $8,000 amid a sharp sell-off that saw prices drop to as low as $7,778 according to Coindesk data."
2019-06-04,'Badger Wallet' for Bitcoin Cash Launches On iOS,"Badger Wallet, a popular BCH storage app, is coming to iOS."
2019-06-04,Long-Term Support Level May Struggle to Revive Bitcoin Price Rally,"Bitcoin’s price pullback seems to have stalled near historically strong support, but a bounce, if any, could be shallow."
2019-06-04,Tron Founder's Winning $4.5 Million Bid Nets Dinner With Warren Buffett,Warren Buffett will chow down on steak with Justin Sun after Sun donated $4.57 million to a homeless charity.
2019-06-04,The 8 Biggest Bombshells From the SEC's Kik ICO Lawsuit,"In a complaint filed Tuesday, the SEC laid out where Kik allegedly ran afoul of U.S. securities law with its $98 million ICO in 2017. It also revealed a lot more."
2019-06-05,0,0
2019-06-05,Lightning Co-Creator Releases Code for Bitcoin Scaling Concept,Co-author of the lightning network white paper Tadge Dryja has released new code for a proposed scaling solution he's been working on for a year.
2019-06-05,"'Gold Is Superior to Bitcoin,' Say People Who Sell Gold",The founder of GoldMoney.com is upset that Grayscale compared gold unfavorably to cryptocurrencies.
2019-06-05,Mark Karpeles: Bitcoin Security Tech Needs an Update,The disgraced crypto CEO Mark Karpeles has a new book and a new mission: to secure bitcoin.
2019-06-05,Bitcoin Recovers From 2-Week Low But Price Outlook Remains Bearish,"Bitcoin’s ongoing corrective bounce could be short-lived, as the charts are signaling a short-term bullish-to-bearish trend change."
2019-06-05,Former Mt Gox CEO Says He Wants to Restore Japan as Tech Leader,"Former Mt. Gox chief Mark Karpeles has reportedly revealed he's ""starting from zero"" with an IT project."
2019-06-06,0,0
2019-06-06,"Bitcoin's 2019 Price Run Driven By Real Transaction Growth, Analysis Shows","Bitcoin's TAAR (transaction amount to active addresses ratio) is hovering around 7-month highs, potentially adding a fundamental validation to bitcoin's latest price growth."
2019-06-06,"Bitcoin and Gold Prices Diverge Again, Extending 5-Month Correlation","Bitcoin has shed $1,400 over the last seven days, contradicting gold's 5.4 percent price rise to the highest since February."
2019-06-06,Bitcoin Struggles to Build Momentum After Defense of $7.4K Price Support,"A key technical line applied brakes to bitcoin's sell-off earlier this week, but so far the bounce has been shallow, with upside capped around $7,900."
2019-06-06,DARPA-Funded Study Looks at How Crypto Chats Spread on Reddit,A U.S. Department of Energy science lab has been studying how well three popular cryptos performed in Reddit chats. Here's what they found.
2019-06-06,S.L. Benfica Is The First Major European Football Club To Accept Cryptocurrency,S.L. Benfica fans can now lay down bitcoin and ether to pick up a team jersey.
2019-06-07,0,0
2019-06-07,Bitcoin Trade Volume on Coinbase Hit a 14-Month High in May,"Coinbase recorded its most bitcoin trade volume in 14-months during May when over 739,000 bitcoins traded hands."
2019-06-07,Vancouver Saw the First-Ever Bitcoin ATM. Now Its Mayor Wants to Ban Them,The decision will affect 76 machines within the city limits.
2019-06-07,May Was Best Month for CME Bitcoin Futures Volume Since 2017,May was the best month for derivatives giant CME's bitcoin futures volume since its 2017 launch
2019-06-07,Bitcoin Price Eyes Stronger Recovery Rally After Bounce to $8K,"Bitcoin has recovered to $8,000 after defending key support for two consecutive days and may remain well bid over the weekend."
2019-06-07,What to Expect When the IRS Alters Its Bitcoin Tax Policy,Coming guidance from the IRS is expected to clarify longstanding crypto tax questions. Here's what to look for.
2019-06-08,0,0
2019-06-08,How Blockchain Voting Is Supposed to Work (But In Practice Rarely Does),There are a number of blockchain projects affirming they have a system of on-chain governance that works. But is that true?
2019-06-09,0,0
2019-06-10,0,0
2019-06-10,Michael Ford Named Newest Bitcoin Core Code Maintainer,Long-time Bitcoin Core contributor Michael Ford has been named the newest maintainer of the open-source software project.
2019-06-10,100 Bitcoin Users Perform What Might Be Largest 'CoinJoin' Transaction Ever,"The startup behind the privacy-centric bitcoin app Wasabi Wallet recently brought together 100 people to collectively execute a ""CoinJoin"" transaction."
2019-06-10,"Samourai, Nodl to Launch Bitcoin Lightning Node With Mixing Features",A new hardware partnership is helping the team behind Samourai Wallet extend their obsession with privacy to the world of bitcoin nodes.
2019-06-10,Bitcoin Risks Short-Term Bear Reversal Below $7.4K Price Support,"Bitcoin's bulls need to keep prices above key support at $7,432 to avert a short-term bearish reversal."
2019-06-10,Why Academics Love Bitcoin – and Crypto,"For academics, bitcoin, and more broadly crypto, is an exciting space where the ideas they write up in papers actually get built and tested."
2019-06-11,0,0
2019-06-11,Fraud-Fighting 'Watchtowers' to Arrive in Next Bitcoin Lightning Release,"So-called lightning network ""watchtowers"" – a much-anticipated next step for securing the network – are coming soon."
2019-06-11,No Man's Land: Bitcoin Price Locked in $600 Range for 7th Day,Bitcoin's struggle for direction continues with prices locked in a tight range for a week.
2019-06-11,'It Feels Like Family': Bitcoiners Gather for Security Conference in Amsterdam,"For Breaking Bitcoin 2019, technologists gathered in Amsterdam to explore the future of bitcoin."
2019-06-11,Pan-African Insurer Old Mutual Will Not Insure Mining Rigs,"South African insurance company Old Mutual has refused to insure mining rigs in Africa, making it harder to protect cryptocurrency gear there."
2019-06-11,Ex-R3 Director Tim Swanson Joins Blockchain Builder Clearmatics,"Outspoken blockchain analyst Tim Swanson is joining Clearmatics, one of the top rivals to his former employer R3."
2019-06-12,0,0
2019-06-12,Bitcoin Struggles for Price Gains As Litecoin Hits 13-Month high,Bitcoin is lacking a clear directional bias for the eighth consecutive day as litecoin continues to surge.
2019-06-12,Square Hires Ex-Google Director as First Member of New Crypto Team,Square has hired former Google director and Bitcoin Optech contributor Steve Lee as the first member of its new crypto team.
2019-06-12,Brazil's President Rebuffs Cryptocurrency as Administration Explores Blockchain,"“I don’t know what Bitcoin is,” Brazilian President Jair Bolsonaro says even as his administration eyes blockchain projects."
2019-06-12,CryptoCompare Launches Benchmark Rankings for Exchanges,"Cryptocurrency data and indices provider CryptoCompare is working to make it easier to spot good, and bad, crypto exchanges."
2019-06-12,Inside Monero's 'Last Ditch Effort' to Block Crypto Mining ASICs,The Monero community is making one last attempt to block specialized mining hardware devices from the network.
2019-06-13,0,0
2019-06-13,Bakkt Reveals Bitcoin Futures Contract Details Ahead of July Test Date,"Bakkt will begin user testing of its bitcoin futures contracts on July 22, revealing new contract specifications on Thursday."
2019-06-13,Bitcoin Startup Bitrefill Raises $2 Million Funding for Global Expansion,The lightning-centric bitcoin startup plans to use this funding to expand services to almost every country in the world by 2020.
2019-06-13,Could Bitcoin's Lightning Power Mobile Communications? This Startup Thinks So,New research from mobile mesh networking company goTenna explores how bitcoin's lightning network can help decentralize mobile communications.
2019-06-13,Bitcoin Price Eyes Chart Pattern That Kicked Off Bull Market in 2015,Bitcoin is about to see a key bullish cross of two moving averages the first time in nearly four years.
2019-06-13,$6 Million in Stolen Binance Bitcoin Is On the Move Again,"A series of hops and ""payments"" shows that the Binance hackers are working to access some of their stolen millions."
2019-06-14,0,0
2019-06-14,"Bull Trap? Bitcoin’s Price Rise to $8,300 Isn’t Backed by High Volumes",A clear divergence between prices and trading volumes on the charts suggests bitcoin’s recent $800 rally could be short-lived.
2019-06-14,A Protocol for Issuing Tokens Launches on Bitcoin’s Lightning Network,The first protocol for issuing tokens via bitcoin’s lightning network is aimed to rival ethereum's ERC-20. But that's a tall order.
2019-06-14,Jack Dorsey Hints at How Square Crypto May Support Bitcoin's Code,Twitter and Square CEO Jack Dorsey has revealed more details about the role Square Crypto might play in boosting bitcoin development.
2019-06-14,Crypterium Introduces Global Crypto Payments Card,"The card offers zero fees for bitcoin, ethereum, and litecoin transactions."
2019-06-14,"Facebook's GlobalCoin May Be A 'Historic Initiative,' Say RBC Analysts",Analysts are bullish on Facebook's upcoming blockchain product.
2019-06-15,0,0
2019-06-15,Bitcoin Surpasses 1 Million Daily Active Addresses,"The last time Bitcoin shot past 1 million daily active addresses was in November, 2017."
2019-06-15,It's FATF's Way or the Highway for Crypto Exchanges. That's a Big Mistake,"The crypto industry can fight money launderers effectively, but not the way FATF wants it to, a CEX.IO compliance officer writes."
2019-06-15,I Was Reddit's First (And Only) Cryptocurrency Engineer,"Before his move to supporting Craig Wright's bitcoin SV, Ryan X Charles describes his short-lived tenure at reddit and the trolls who made his life hell."
2019-06-16,0,0
2019-06-16,Above $9.3K: Bitcoin's Price Prints 13-Month High,"Bitcoin's price rose to 13-month highs above $9,300 on Sunday, taking cumulative weekly gains to 17 percent."
2019-06-16,Justin Sun's Crypto Lunch with Warren Buffett Is Genius Marketing at Work,"Justin Sun’s upcoming lunch with Warren Buffett is a genius marketing play that can only help the cryptocurrency sector, writes Noelle Acheson."
2019-06-17,0,0
2019-06-17,3 Reasons Bitcoin Is Rallying Above $9K,"Bitcoin rose above $9,000 over the weekend, taking cumulative year-to-date gains to more than 150 percent. Here's three likely reasons why."
2019-06-17,Breez Reveals Lightning-Powered Bitcoin Payments App for iPhone,"Now in beta for the iPhone, Breez's app harnesses lighting, Neutrino and atomic swaps to make bitcoin P2P payments feasible for daily transactions."
2019-06-17,BitTorrent Creator Bram Cohen Takes Over as CEO at Chia Network,"Bram Cohen has taken over as CEO of his current company, Chia Network – a firm creating a less energy-intensive cryptocurrency."
2019-06-17,Bitmain Lawsuit Seeks Millions from Staffers Who Founded Rival Mining Pool,"Crypto mining giant Bitmain is locked in a legal battle with former employees who started a rival bitcoin mining pool, Poolin."
2019-06-17,Crypto's Connection to the Hong Kong Protests,An effort to change extradition laws in Hong Kong has sparked protests – and questions about digital privacy and the right to transact.
2019-06-18,0,0
2019-06-18,CFTC Lawsuit Alleges $147 Million in Bitcoin Defrauded From Trading Scheme Investors,"22,858.822 bitcoin were misappropriated under Control-Finance's Ponzi-like scheme."
2019-06-18,Bitcoin Price Trades Flat on Facebook Libra Blockchain Launch,Bitcoin is struggling to gather upside traction following Facebook's official announcement of its Libra cryptocurrency project.
