Date,Title,Description
2019-02-04,Kraken Acquires Futures Startup In Deal Worth At Least $100 Million,"Kraken has inked a “nine-figure"" deal that now makes it the only crypto exchange to offer regulated futures trading in Europe."
2019-02-04,Alleged SIM-Swap Crypto Thief Indicted for Hacking Over 50 US Victims,A 20-year-old man has been formally charged in a U.S. supreme court indictment over 52 cases of SIM-swap identity and crypto theft.
2019-02-06,0,0
2019-02-06,Cypherpunk Valentine: Why Shoppers Spend Bitcoin on Lingerie,Lingerie purchasing as a bitcoin use case is much less far-fetched than you might imagine.
2019-02-06,Coinbase's Wallet App Is Getting Bitcoin Support This Week,Coinbase users will be able to directly control their bitcoin holdings from the firm’s Wallet app after a coming update.
2019-02-06,"Bitcoin Is Becoming More Decentralized, Indicates New Research","Bitcoin has become more decentralized by several measures, according to a research report from Canaccord Genuity Group."
2019-02-06,Little-Known Resistance May Be Blocking Bitcoin Price Bounce,Bitcoin price gains may be capped by a key moving average that has been acting as stiff resistance since mid-January.
2019-02-06,"Abra's Blockchain App to Let Users Invest in Fractions of Stocks, ETFs",Abra is adding a new feature to its blockchain-based app that will allow global users to invest in fractions of stocks and ETFs.
2019-02-07,0,0
2019-02-07,Blockchain Analysis Links Hamas Fundraising to Coinbase Bitcoin Account,"Hamas is soliciting bitcoin donations for its military operations, but so far has only garnered a few thousand dollars."
2019-02-07,Someone Is Impersonating Bitcoin Futures Platform Bakkt to Raise Money,There's a website out there masquerading as Bakkt in an apparent attempt to bilk people out of their bitcoin.
2019-02-07,Little Relief in Sight as Bitcoin Price Closes at 7.5-Week Low,"With bitcoin closing yesterday at the lowest level in 7.5 weeks, the gradual sell-off is showing no signs of abating."
2019-02-07,Crypto Futures Platform ErisX Hires Execs From Barclays and YouTube,Crypto trading firm ErisX has hired a COO from megabank Barclays and a head of infrastructure from YouTube.
2019-02-07,Crypto Broker Led by Uber and E*Trade Alums Is Going Public,"Voyager, a crypto brokerage founded by Uber and E*Trade alums, is going public via a $60 million reverse merger."
2019-02-08,0,0
2019-02-08,SEC Commissioner Says Bitcoin ETF Will Be Approved 'Eventually',"A U.S. SEC commissioner, Robert J. Jackson Jr. has said he believes a bitcoin exchange-traded fund will ultimately be approved."
2019-02-08,"Bitcoin Pops Above $3,700 As Crypto Market Flashes Green",The broader cryptocurrency market picked up strong bid during Friday's trading session with litecoin (LTC) leading the charge.
2019-02-08,Bitcoin Price Still Trading Flat While Litecoin Hits 7-Month High,"Bitcoin, which continues to languish near seven-week lows, is being outshone by a surge in litecoin prices."
2019-02-08,Latest Lightning Code Release Trolls With a 'Block Size' Increase,"The latest code version for the lightning network, often trumpeted as the future of bitcoin payments, includes a ""block size increase."""
2019-02-08,Funds Were Moving On QuadrigaCX Right Before Its Collapse,"Nearly $1 million worth of ether left QuadrigaCX's hot wallet for other cryptocurrency exchanges in December, the same month its CEO reportedly died."
2019-02-09,0,0
2019-02-09,Inside the Museum of Bitcoin: An Interactive Tour of Crypto History,"We took a tour of the Museum of Bitcoin, a pop-up installation at The North American Bitcoin Conference 2019. It was a trip down memory lane."
2019-02-10,0,0
2019-02-12,0,0
2019-02-12,QuadrigaCX Lost Another $500K in Bitcoin By Mistake: EY Report,QuadrigaCX lost another 100 bitcoin after transferring them to a cold wallet it previously said it cannot access.
2019-02-12,Bitcoin Price Pattern Hints at Short-Term Rally to $4K,Bitcoin’s overnight pullback from three-week highs hit on Friday doesn’t mean the rally is over.
2019-02-12,"Litecoin's Halving Is Months Away, But Traders May Already Be Pricing It In",Traders may already be pricing in litecoin's upcoming block reward halving.
2019-02-12,Binance's Decentralized Exchange Is About to Launch for Public Testing,"In less than two weeks, Binance will release its decentralized exchange, Binance DEX, on a public testnet."
2019-02-12,Blockchain Sleuthing Startup Chainalysis Raises $30 Million,"The Series B funding was led by seasoned VC firm Accel and included investment from Benchmark, which led the firm's $16m Series A."
2019-02-13,0,0
2019-02-13,Blockchain Analysis Ties 5 Bitcoin Addresses to QuadrigaCX Exchange,Researchers have identified a group of bitcoin addresses that likely belonged to the cold wallets of failed exchange QuadrigaCX.
2019-02-13,Nasdaq to Add Bitcoin and Ethereum Indices to Global Data Service,"Nasdaq, the second-largest stock exchange in the world, is adding bitcoin and ethereum indices to its global data service later this month."
2019-02-13,ETF Tied to Bitcoin Futures Withdrawn After SEC Staff Request,The withdrawal of a proposed ETF that would have had exposure to bitcoin futures comes just days after its submission to the SEC.
2019-02-13,Bitcoin Making Little Headway as Resistance Caps Price Gains,"Bitcoin's struggle to cross a key moving average lined up above $3,600 is a cause of concern for the bulls."
2019-02-13,GMO Internet’s Crypto Business Reports $12 Million Loss in 2018,"Japanese IT giant GMO Internet has reported an operating loss of nearly $12 million for its crypto business in 2018, with mining worst hit."
2019-02-14,0,0
2019-02-14,Coinbase Exchange Users Can Now Withdraw Bitcoin Cash Fork BSV,The largest US-based cryptocurrency exchange Coinbase has allowed its users to withdraw BSV three months after the hard fork.
2019-02-14,Long-Term Indicator Suggests Bitcoin Price May Be Nearing Bottom,A long-term price indicator validates a growing consensus among investors that bitcoin is close to bottoming out.
2019-02-14,State of Blockchains: Bitcoin (BTC) Fees,0
2019-02-14,Blockchain Startups Are Modernizing Iran's Financial Infrastructure,Sources in Iran say the country's financial sector is taking clear steps toward a state-backed token economy.
2019-02-14,JPMorgan Has Its Own Crypto and It's Starting Real-World Trials,"JPMorgan has built a crypto token and it's moving to real-world trials in ""a few months,"" according to a CNBC report."
2019-02-15,0,0
2019-02-15,NYSE Arca Filing Kicks Off Countdown for New Bitcoin ETF,The clock just started on the latest effort to launch a bitcoin ETF from NYSE Arca and Bitwise Asset Management.
2019-02-15,How SABRE Tech Can Stop Hackers From Splitting Bitcoin Into Two,"Hackers could attack bitcoin with a flood of data, but researchers say they have a solution in the form of a relay network called SABRE."
2019-02-15,Bitcoin's Sideways Drift Has Shifted Price Recovery Target to $3.7K,"Bitcoin's six days in the doldrums has weakened the bull case in the short term, leaving a target of $3,700 for a resumed rally."
2019-02-15,'Make Bitcoin Fun Again': New Lightning App Lets You Buy Pizza With BTC,"Using the Lightning Network, more than 150 people bought Domino's pizza with bitcoin this week."
2019-02-15,"tZERO Is Live, But Volume Is Light and Its Token's Price Is Down Sharply",Daily trading volume on the recently launched tZERO platform is less than 1% the total supply of the only listed security token.
2019-02-16,0,0
2019-02-16,Bitcoin Is... Bitcoin Just Is What?,"What is bitcoin? 40 experts show that 10 years later, it's still a question with a variety of answers."
2019-02-16,Metrics May Point to Ether Being Undervalued,There is a dichotomy between theory and practice of what fundamental demand indicators should be driving the price of ether.
2019-02-17,0,0
2019-02-17,Mayer Multiples: The Metric That Helps Call Bitcoin Bubbles and Bottoms,Identifying speculative bubbles or bearish exhaustion may be possible through the use of a fairly new metric known as the Mayer Multiple.
2019-02-18,0,0
2019-02-18,Blockstream Releases Test Code for Proposed Bitcoin Tech Upgrade Schnorr,Schnorr signatures are no longer just another idea for improving bitcoin thanks to a new code library from Blockstream.
2019-02-18,You Can Now Send Bitcoin Tips Over Lightning on Twitter,"When ""liking"" your favorite tweet isn't enough, you can now send small bitcoin tips via the lightning network."
2019-02-18,"Bitcoin Price Passes $3,700 to Hit One-Month High","Bitcoin's high-volume move to one-month highs could be the start of a stronger rally to above key resistance near $3,760."
2019-02-18,Bullish Sentiment for Bitcoin As Long Bets Near 11-Month Highs,"Bullish bets on bitcoin, the world's largest cryptocurrency by value, reached 11-month highs on Monday."
2019-02-18,"Bitmain Announces New, More Efficient 7nm Bitcoin Mining Chip",Bitmain Technologies has announced a new 7nm bitcoin mining processor that it says offers a big boost in energy efficiency.
2019-02-19,0,0
2019-02-19,Funds in Short Positions on Bitcoin Drop to 6-Month Low,The amount of money allocated to short bets against bitcoin fell to a more than 6-month low today.
2019-02-19,Bitcoin Price Crosses Key Long-Term Hurdle For First Time in 4 Months,"Bitcoin has broken the 100-day moving average for the first time in 127 days, and briefly passed $3,950 overnight."
2019-02-19,Countdown Restarts Today for SEC Decision on CBOE-VanEck Bitcoin ETF,"The VanEck/SolidX bitcoin ETF proposal is slated for publication in the Federal Register tomorrow, giving the SEC 45 days to approve, reject or extend a decision on it."
2019-02-19,Coinbase Acquires Blockchain-Tracking Startup Neutrino for Undisclosed Price,Coinbase has acquired blockchain analytics startup Neutrino as part of a push to offer more diverse crypto assets.
2019-02-19,Ethereum Mining Pool Receives Mysterious $300K Blockchain Payout,"Cryptocurrency mining pool Sparkpool received a payout today of over $300,000 for mining one block on the ethereum blockchain."
2019-02-20,0,0
2019-02-20,A DIY Bitcoin Lightning Node Project Just Hit Its 1.0 Milestone,A project aiming to empower people to build bitcoin lightning nodes has hit a notable milestone.
2019-02-20,The SEC Is Now Reviewing 2 Bitcoin ETF Proposals,"There are two bitcoin ETFs under review by the SEC, after the VanEck/SolidX proposal was published in the Federal Register Wednesday."
2019-02-20,"Elon Musk Calls Bitcoin 'Brilliant,' Better Than Paper Money for Value Transfer","Elon Musk, CEO of Tesla, has gone public with his belief that crypto offers an improved alternative to conventional money."
2019-02-20,Bitcoin Price Looks North As Trading Volumes Hit 9-Month Highs,"Bitcoin could revisit December highs above $4,200 in the near-term as the recent rally is backed by a surge in trading volumes."
2019-02-20,"Cryptos 'Not a Substitute' for the Precious Metal, Says World Gold Council","Cryptocurrencies can't match gold on stability and volume, and are not a direct competitor, says the World Gold Council."
2019-02-21,0,0
2019-02-21,"Don't Expect Bitcoin's Supply to Change, Says Core Maintainer Wlad van der Laan","In a new interview, bitcoin's lead maintainer, Wlad van der Laan, argues any change to the cryptocurrency's supply would erode its utility and value."
2019-02-21,QuadrigaCX Has Sent All Its Bitcoin and Ether to 'Big Four' Auditor EY,"QuadrigaCX's ""hot"" wallets for bitcoin and ether have been nearly emptied, with the funds now held by court-appointed monitor EY."
2019-02-21,Bitcoin Price 'Bull Cross' Points to Positive Market Shift,"A much-followed bitcoin price indicator has turned bullish for the first time in seven months, indicating a trend change in the market."
2019-02-21,$430K in Confiscated Crypto to Be Sold Off by Irish Auction House,Cryptocurrencies seized by Belgian law enforcement from online drug dealers are set to be sold off by an Ireland-based auction house.
2019-02-21,Ether Outlook Improves as Price Pushes Above Key Moving Averages,The world’s second largest cryptocurrency by market capitalization has seen a stronger showing from the bulls after rising 36.77 percent in February so far.
2019-02-22,0,0
2019-02-22,Bitcoin Remains On Hunt For $4.2K Despite Price Consolidation,"Bitcoin's three-day price consolidation looks to be a bull breather before a continuation of the recent rally to above $4,000."
2019-02-22,Hands-On Preview of Samsung's Galaxy S10 Phone Reveals New Crypto Details,"A hands-on preview of Samsung's just-unveiled flagship phone, the Galaxy S10, reveals new details of the device's upcoming crypto features."
2019-02-22,Andreas M. Antonopoulos Warns Against Ethereum In-Fighting,"In an address to the ethereum community, the blockchain expert warns against fragmentation and in-fighting as a result of market pressures."
2019-02-22,Overstock CEO Predicts Late 2019 Boost in tZERO Token Trading,Overstock's CEO says he expects volumes on the recently launched tZERO platform to soar after the market opens to retail investors in August.
2019-02-23,0,0
2019-02-23,The First Car Purchased With Bitcoin Is Now the World's Most Expensive Prius,"CoinDesk takes a ride in the first car ever purchased with bitcoin – a Prius paid for with 1,000 BTC."
2019-02-24,0,0
2019-02-24,Back Above $4k: Bitcoin's Price Jumps to a Two-Month High,"Bitcoin's price returned above $4,000 on Saturday for the first time in over eight weeks as the broader cryptocurrency market flashed green."
2019-02-24,Bitcoin Has a Florida Problem,Jurisdictions that lack clear guidance or take a hostile view of blockchain and crypto hurt the industry. Florida is doing both.
2019-02-24,Validators Create New Attack Vectors for Decentralized Systems,Bounty0x CMO Pascal Thellman discusses some of the potential security and incentives issues with validators on proof-of-stake networks.
2019-02-25,0,0
2019-02-25,Warren Buffet: Bitcoin Is a 'Delusion' But Blockchain Is 'Ingenious',Warren Buffett has reiterated his negative view of bitcoin but expressed admiration for the underlying technology.
2019-02-25,Bitcoin Shorts Dropped to 11-Month Lows During Sunday's Sell-Off,Funds allocated to BTC/USD short positions on Bitfinex fell to 11-month lows on Sunday as the price of bitcoin fell more than 8 percent.
2019-02-25,"Long-Term Bitcoin Price Indicator Turns Bearish, Suggesting Bottom May Be In","Bitcoin likely bottomed out in December and could begin a new bull run this year, as a lagging indicator has turned bearish for the first time in four years."
2019-02-25,Bitcoin's Bull Trend At Risk After High-Volume Price Dump,"Bitcoin nosedived overnight, clouding the interim bullish outlook, and a deeper drop could unfold if key support near $3,700 is breached."
2019-02-25,NFTs Are Here. But Where Are They Headed?,"The best business model for crypto collectibles is currently unclear, but some compelling ideas arose at a New York event last week."
2019-02-26,0,0
2019-02-26,"Bitcoin Price Holds Above $3,700 But Bulls Need Progress Soon","Bitcoin risks a further sell-off if the bulls' defense of $3,700 fails to produce quick recovery."
2019-02-26,Bolivars to Bitcoin: Activists Take Down Venezuela's Maduro in Crypto Art Exhibit,"As the situation in Venezuela continues to escalate, artist cryptograffiti, crypto exchange AirTM and merchant services provider Cripto Conserje have teamed up for an all-day..."
2019-02-26,"There's No Crypto Winter in Argentina, Where Startups Ramp Up to Meet Demand",Argentina's thriving crypto startup scene offers a unique cocktail of technical development and tangible user demand for bitcoin.
2019-02-26,$66 Million Building to Be Tokenized on Ethereum Blockchain in Record Deal,Inveniam Capital Partners is soon to offer tokenized securities representing $260 million-worth of shares in four properties.
2019-02-26,Jamie Dimon: JPM Coin Could 'One Day' See Consumer Use,JPMorgan's CEO has suggested that consumers could eventually use its U.S. dollar-linked token.
2019-02-27,0,0
2019-02-27,"LinkedIn Founder, Fidelity Latest to Carry Bitcoin's 'Lightning Torch'",The latest big names to join the bitcoin payments experiment are financial giant Fidelity Investments and LinkedIn co-founder Reid Hoffman.
2019-02-27,Bitcoin Price On Track to End Six-Month Losing Streak,Bitcoin looks set to end its record six-month losing streak with modest gains in February.
2019-02-27,Fidelity Joins $1.9 Million Round in Blockchain Data Startup Coin Metrics,"Coin Metrics, an open-source data research project, will now offer commercial services to institutional investors."
2019-02-27,London Stock Exchange Leads $20 Million Fundraise for Blockchain Startup Nivaura,"Nivaura, a startup tokenizing traditional financial instruments, has raised $20 million from investors led by the London Stock Exchange Group."
2019-02-28,0,0
2019-02-28,Square Brought in Over $166 Million Through Bitcoin Sales Last Year,Mobile payments firm Square has reported its revenue and profits from bitcoin sales in 2018.
2019-02-28,Bitcoin Price May Rise in March Despite Month's Bearish Track Record,"Bitcoin is heading into a historically weak month on a positive note and could see gains if resistance at $4,190 is breached."
2019-02-28,Bitcoin Lightning Tech Expands Beyond Invoices in Step Toward Better UX,New tech by a principal developer could soon make it possible for bitcoin's lightning network to expand to new use cases.
2019-02-28,Bittrex Leads $1.5 Million Round for South African Crypto Exchange VALR,"South Africa's VALR exchange is launching March 1, expanding bitcoin access across the continent."
2019-02-28,Kraken Exchange Offers $100K Reward for Missing QuadrigaCX Crypto,"Kraken is offering up to $100,000 to anyone who can help locate QuadrigaCX's missing cryptocurrency holdings."
2019-03-01,0,0
2019-03-01,$100 Million Short: QuadrigaCX Audit Can't Account for 26K Missing Bitcoin,QuadrigaCX's court-appointed monitor has finally provided blockchain addresses for the exchange's cold bitcoin wallets. They're nearly empty.
2019-03-01,"Early AlphaPoint Employee Goes Full Bitcoin, Joins Casa","Michael Haley has left security token platform AlphaPoint for crypto custody provider Casa, saying he wants “to get back into good old bitcoin.”"
2019-03-01,Angry Bitcoin Fans Delete Coinbase Accounts to Protest Neutrino Acquisition,Upset Coinbase users are closing their accounts after the crypto exchange acquired an analytics startup with a controversial past.
2019-03-01,Bitcoin Awaits Decisive Price Move as Trading Range Tightens,"Bitcoin has witnessed indecisive trading in the last 48 hours and would turn bullish again if prices rise above $3,900."
2019-03-01,Federal Reserve May Add Bitcoin Crash to Stress Test Scenarios,The U.S. Federal Reserve could soon include a bitcoin market crash as one of the risks to take into account when conducting stress tests.
2019-03-02,0,0
2019-03-02,Long the Bankers! Why Security Tokens Need Trusted Middlemen,"Ami Ben David argues that the security token sector is not about replacing trusted middlemen. Rather, it needs them to support trust in the assets."
2019-03-03,0,0
2019-03-04,0,0
2019-03-04,Bitcoin Coders Send International Lightning Payment Over Ham Radio,"In what appears to be a first-of-its-kind transaction, developers have successfully sent a bitcoin lightning payment over radio waves."
2019-03-04,Bitcoin's MACD Prints Strongest Bull Signal In Over a Year,"Bitcoin's MACD histogram is registering its highest value since January of 2018, which suggests bitcoin's price may have already bottomed out."
2019-03-04,Bitcoin's Lightning Torch Enters Iran as Payment Experiment Blazes On,Bitcoin's lightning torch has made it to Iran – a milestone participants feel shows the payment network's censorship resistance.
2019-03-04,Another Bitcoin Indicator Signals Price Bottom May Be Forming,"A technical indicator, which incorporates both bitcoin's price and trading volume, is signaling the cryptocurrency may have bottomed in December."
2019-03-04,Bitcoin Betting Game Hxro to Add Thousands of Waitlisted Users,"In beta since January, bitcoin betting game Hxro is adding thousands of waitlisted users today."
2019-03-05,0,0
2019-03-05,"Bitcoin Miners Are Investing Again, Expecting a Cheap Power Boom Soon",Bitcoin miners in China are betting that abundant water this summer will make their business profitable again.
2019-03-05,Bitcoin Seeking Gains After Retaking Key Price Support,"Bitcoin has returned above crucial support at $3,700 and could bounce higher if it can defend that level going forward."
2019-03-05,Futures Trading Nears $1 Billion in First Month at Kraken Crypto Exchange,"Crypto Facilities, which provides futures data to CME, saw its own trading volume jump five-fold after being acquired by Kraken."
2019-03-05,"Crypto Exchange WEX Linked to Iranian Ransomware Operators, Says PwC","Cryptocurrency exchange WEX, formerly called BTC-e, may have been used to launder illicit gains from the SamSam ransomware, according to PwC."
2019-03-05,BlockFi Now Offers a Crypto Deposit Account With Compound Interest,Cryptocurrency lending startup BlockFi has launched a deposit account that it says provides 6.2 percent compound interest annually.
2019-03-06,0,0
2019-03-06,People Are Paying Bitcoin to Send Weird and Wild Messages Into Space,0
2019-03-06,Bitcoin Eyes $4K After Erasing Monday's Price Losses,"With bitcoin's quick reversal of the losses seen on Monday, the technical charts are again pointing to a rally to $4,000."
2019-03-06,Ethereum Investment Vehicle Now Live on Swiss Stock Exchange SIX,Swiss stock exchange SIX Group has listed an ethereum-based exchange-traded product (ETP) backed by Amun.
2019-03-06,New Crypto Hardware Wallet Fits Your Phone's SIM Card Slot,U.S.-based startup VaultTel has launched a tiny cryptocurrency hardware wallet that sits in the SIM tray of mobile phones.
2019-03-06,"Argentinian Government to Invest in Blockchain Projects Backed by Binance Labs, LatamEx",The government of Argentina is set to match investments in local blockchain startups taking part in Binance Labs' incubator program.
2019-03-07,0,0
2019-03-07,Binance's Crypto BNB No Longer Tracks Bitcoin – And That's a Big Deal,The price trend of Binance Coin is significantly deviating from that of bitcoin and other well known cryptos as it continues to see rapid gains.
2019-03-07,Ex-Bitmain Bitcoin Cash Staffers Form Startup to Lend and Trade Crypto,"A startup formed by former Bitmain employees will offer crypto custody, OTC trading and lending."
2019-03-07,Three Price Resistance Levels to Beat for Bitcoin's Bulls,Bitcoin still needs to beat several key resistance levels to confirm a longer-term bull reversal.
2019-03-07,Fidelity Crypto Chief Says Hard Fork May Delay Firm's Support for Ethereum,"Fidelity's crypto trading and custody business is live and supporting bitcoin, but adding ether might take a while."
2019-03-07,73% of UK Consumers Say They Don’t Know What Cryptocurrency Is,"Three-quarters of U.K. consumers don't know what a cryptocurrency is or can't define it, according to a survey by the nation's financial regulator."
2019-03-08,0,0
2019-03-08,Bitcoin Struggles to Pass Price Hurdle But Bull Outlook Intact,"Bitcoin's repeated failure to beat resistance at $3,900 is a slight cause of concern for the bulls."
2019-03-08,Swissquote Bank Launching 'Nuke Proof' Crypto Custody,Online banking group Swissquote is launching a custody service that will see crypto keys stored in an ex-military bunker.
2019-03-08,Revolut App Now Lets Users Auto-Trigger Cash and Crypto Exchanges,Mobile finance app Revolut has launched a new feature allowing users to preset automatic cash and crypto exchanges at a target rate.
2019-03-08,SEC's 'Crypto Mom' Sounds Note of Caution About National Action Plans,Commissioner Hester Peirce offered caveats about nationally coordinated efforts at a D.C. blockchain conference.
2019-03-08,Your Guide to Blockchain and Cryptocurrency Events at SXSW 2019,There's an official blockchain and cryptocurrency track at SXSW this year. Here are the events that stand out.
2019-03-09,0,0
2019-03-09,JP Morgan’s Stablecoin: A Feat of Engineering or Marketing?,"Upon first examination, JPM coin is an exciting Wall Street development, but the reality is more complicated, writes Kadena's Ben Jessel."
2019-03-10,0,0
2019-03-11,0,0
2019-03-11,A Bitcoin Bull Market Is Still $350 Away,"Bitcoin needs to print a higher high above $4,236 to confirm a long-term bullish reversal, technical charts suggest."
2019-03-11,A Blockchain ETF Is Launching on the London Stock Exchange Today,Investment management firm Invesco is launching a blockchain exchange-traded fund (ETF) on the London Stock Exchange on Monday.
2019-03-11,Swiss Exchange to List XRP Exchange-Traded Investment Product,"Swiss stock exchange SIX will soon list an XRP-based ETP from Amun AG, with other crypto products planned for later in 2019."
2019-03-11,"Samsung Unveils Cryptocurrency Wallet, Dapps for Galaxy S10 Phone","Samsung Electronics has revealed the cryptocurrency wallet and first official dapps for the S10 phone, and there's a notable absentee."
2019-03-11,Ethereum's ProgPoW Proposal: An Expensive Game of Whack-a-Mole,"Ethereum's ProgPoW proposal may appear to minimize the ASIC advantage, but it isn't as democratizing as claimed, argue Dovey Wan and Martina Long."
2019-03-12,0,0
2019-03-12,Bitcoin Will Soon See 'Bull Cross' in First Since August 2018,A widely-followed bitcoin price indicator is about to turn bullish for the first time in seven months.
2019-03-12,"Binance's Trust Wallet Adds Support for XRP, Credit Card Payments","Cryptocurrency exchange Binance’s official wallet, Trust Wallet, has added support for XRP and credit card payments."
