Date,Title,Description
2019-03-12,SEC Chair Clayton Affirms Agency's Stance Ether Is No Longer a Security,"In a new letter, SEC Chairman Jay Clayton reiterated that some digital assets may not qualify as securities anymore, even if they might have once."
2019-03-12,The SEC's Crypto Czar Is Hitting the Road – And She Wants to Meet You,The SEC is visiting cities around the U.S. to meet with crypto startups about token offerings and solicit feedback on existing regulations.
2019-03-13,0,0
2019-03-13,Bitcoin Price Trapped in Key Make-or-Break Trading Range,"Bitcoin is trapped in a key trading range for the 13th week, with a break above the upper edge needed to confirm a longer-term bull reversal."
2019-03-13,It's Getting Harder to Send Bitcoin’s Lightning Torch – Here's Why,"An experiment pushing the boundaries of crypto payments, bitcoin's Lightning Torch is suffering liquidity issues due to its success."
2019-03-13,"4 Crypto Assets Break Above Key Moving Average, Leaving Bitcoin Behind","A few well-known cryptocurrencies are currently trading above their 200-day moving averages, which is widely considered to be a sign of a healthy market, yet the long lime mar..."
2019-03-13,"Polychain, DCG Invest in Crypto Futures Exchange CoinFLEX",Venture capital firms Polychain and Digital Currency Group have invested an undisclosed sum in cryptocurrency futures exchange CoinFLEX.
2019-03-13,Don’t Count on Decentralization to Rule Crypto Out as Security: VanEck Exec,"VanEck's Gabor Gurbacs has questioned whether being ""sufficiently decentralized"" means a crypto is not a security, as suggested by SEC execs."
2019-03-14,0,0
2019-03-14,Cboe Exchange Puts Brakes on Bitcoin Futures Listing,"Cboe said it would not add a new bitcoin futures market for March, citing a need to review how it approaches the space."
2019-03-14,Bitfury Integration to Bring Bitcoin Lightning Payments to More Merchants,The Bitfury Group has partnered with business payments processor HadePay to bring lightning network-based bitcoin payments to merchants.
2019-03-14,Court Rules Quoine Exchange Liable for Reversing Bitcoin Trades Worth Millions,"A Singapore court has ruled crypto exchange Quoine liable for reversing trades for a total of 3,092 bitcoin by market maker B2C2."
2019-03-14,Bitcoin Trades Flat While Altcoins Tease Bull Breakout,Bitcoin's struggle for direction continues amid growing signs of a bull reversal in alternative cryptocurrencies.
2019-03-14,Crypto Platform DX.Exchange Adds Secondary Trading of Security Tokens,"DX.Exchange, a crypto platform that soft-launched in January, has added support for secondary trading of security tokens."
2019-03-15,0,0
2019-03-15,Bitcoin Trading Volume Tops $11 Billion For First Time In Nearly a Year,"Daily bitcoin trading volumes topped $11 billion Friday, the most seen since April 2018."
2019-03-15,"'No Change' to Bitcoin Futures Plans, CME Says, as Cboe Pulls Back","CME says it has ""no changes"" in store for its bitcoin futures contract, following retrenchment by rival Cboe."
2019-03-15,I Got the Mark of the Beast – And It Will Hold My Bitcoin,"There's a lot of overlap between bitcoiners and body hackers. CoinDesk editor Bailey Reutzel traveled to Austin, Texas to explore that crossroads and become a bitcoin holding..."
2019-03-15,Strong Bitcoin Volumes Bode Well for Price Breakout,"Bitcoin's current period of price consolidation may end with a bull breakout, price-volume analysis indicates."
2019-03-15,Decentralized or Nothing: Song Duels IBM Over Blockchain Hype at SXSW,An event at SXSW pitted Blockchain Capital's Jimmy Song against IBM's Chris Ferris in a debate over permissioned vs. permissionless blockchains.
2019-03-16,0,0
2019-03-16,WATCH: I'm Turning My Hand Into a Bitcoin Wallet,0
2019-03-16,Riot Blockchain to Launch Regulated Crypto Exchange in the US,Riot Blockchain is planning to launch a regulated exchange in the U.S. to offer crypto banking and trading services.
2019-03-16,Caution and Crypto Custody: Convenient Companions,"Crypto custody is more complex than most of us realize, explains Noelle Acheson. Caution is wise, even if it slows institutional involvement."
2019-03-17,0,0
2019-03-18,0,0
2019-03-18,Bitcoin’s Price and Network Activity: One is Outpacing the Other,"Active addresses on bitcoin's blockchain have increased 20 percent in recent weeks. So, why is the BTC price trading sideways?"
2019-03-18,An Old Resistance Hurdle Is Back and Could Stall Bitcoin's Price Rally,Bitcoin's four-week price rally now faces a former support-turned-resistance level that repeatedly capped gains in 2018.
2019-03-18,A Lightning API for Bitcoin Futures Data Has Launched,An experimental service that allows users to pay for futures data from exchanges Kraken and BitMEX via the lightning network is now live.
2019-03-18,When Bakkt? Bitcoin Futures Market's Approval Appears Stuck in Limbo,"More than six months since ICE revealed its vision for Bakkt, the bitcoin futures market is still awaiting regulatory approval."
2019-03-18,CoinMarketCap Crypto Assets Now Feature Flipside Letter Grades,Flipside Crypto aims to make its Fundamental Crypto Asset Score as widespread as price-to-earnings ratios for stocks.
2019-03-19,0,0
2019-03-19,Bitcoin's Share of Total Crypto Market Slips Back Toward 50%,Bitcoin's share of the cryptocurrency market is on the verge of falling below 50 percent for the first time in over 7 months.
2019-03-19,Bitcoin Faces Minor Price Retreat Amid Increasing Bull Exhaustion,"Bitcoin is showing signs of buyer exhaustion and could see a minor pullback unless resistance at $4,000 is scaled soon."
2019-03-19,Bloq CEO Jeff Garzik Subpoenaed Over Craig Wright's Satoshi Claim,Jeff Garzik has been served a subpoena relating to the ongoing Craig Wright vs. Ira Kleiman lawsuit.
2019-03-19,Fortune 500 Tech Firm Avnet Now Accepts Crypto Payments via BitPay,"Avnet, one of the world's largest distributors of electronic components and services, is now accepting crypto payments through BitPay."
2019-03-19,"Silvergate Bank Adds 59 Crypto Clients, But Deposits Down $123 Million","Silvergate Bank added 59 crypto clients in the fourth quarter, but its deposits from the industry shrank by $123 million."
2019-03-20,0,0
2019-03-20,"Binance Now Lets Australians Buy Bitcoin With Cash at Over 1,300 Stores","Binance has unveiled a new platform in Australia that allows users to buy bitcoin with cash from 1,300-plus newsagents."
2019-03-20,Square Is Hiring New Crypto Engineers — And It Wants to Pay Them in Bitcoin,"Payments startup Square wants to bring on crypto-focused engineers and designers, and may pay them in bitcoin."
2019-03-20,'I'm Freaking Out': How It Feels to Hold the Bitcoin Lightning Torch,How does it feel to hold the famous bitcoin lightning torch? Diana Aguilar explains.
2019-03-20,Casa-Branded Case Brings Military Tech to Bitcoin Wallet Protection,"Casa has just rolled out radio wave-screening ""Faraday bags"" as the ultimate cypherpunk accessory for bitcoin hardware wallets."
2019-03-20,$25 Million in 2 Weeks: BlockFi Booms as Bitcoin and Ether Investors Seek Interest,BlockFi CEO Zac Prince explains in depth how the startup manages the myriad risks of lending and borrowing crypto.
2019-03-21,0,0
2019-03-21,Lightning Labs Releases 'Loop' Feature for Bitcoin Payments Channels,"California startup Lightning Labs released today a new feature to improve usability of the bitcoin payment channel network, lightning."
2019-03-21,Bitcoin Price Charts Echo Pattern Seen Before 2015 Bull Market,Bitcoin's 14-month bear market has ended up creating a similar price pattern to one that paved the way for a bull run in 2015.
2019-03-21,"Bitmain Set to Deploy $80 Million Worth of Bitcoin Miners, Sources Say","Bitmain, the largest manufacturer of crypto mining equipment, is scaling up its capacity to mine bitcoin itself."
2019-03-21,Alleged BTC-e Operator Alexander Vinnik Seeks Extradition to Russia,"Alleged bitcoin launderer Alexander Vinnik, who is wanted by several countries, has filed in Greece for extradition to Russia."
2019-03-21,"Not Just BNB: Up 120%, Huobi's Crypto Exchange Coin Is Breaking Out",Huobi Token (HT) is the latest native exchange cryptocurrency to flash more than 100 percent price growth year to date.
2019-03-22,0,0
2019-03-22,"Bitcoin Futures Volume Is More Significant Than You Think, Bitwise Says","The bitcoin futures market is far larger, relative to the spot market, than previously thought, says Bitwise Asset Management."
2019-03-22,Mt Gox Creditors Warn Mass Sale Could Put Bitcoin Fork Prices At Risk,A group of Mt. Gox creditors has warned of a market risk to forks of bitcoin in a draft plan for the collapsed exchange's civil rehabilitation.
2019-03-22,Bitcoin Price Drops Back Below $4K But Bull Outlook Still Intact,"Bitcoin's short-term outlook will remain bullish as long as prices hold above key support at $3,920."
2019-03-22,Overstock's tZERO Exchange to Launch Bitcoin Trading App This June,"tZERO plans to launch its own mobile trading app for buying and selling bitcoin and, possibly, ether."
2019-03-22,You Can Now Donate to the Tor Project in 9 Different Cryptocurrencies,"The Tor Project is now accepting crypto donations directly, taking bitcoin, ether, monero, zcash and 5 others."
2019-03-23,0,0
2019-03-23,Satoshi Square: How Bitcoin Took Over a Park (And Then the World),"Before we knew whether bitcoin was legal or illegal, a group on New Yorkers created an in-person meetup for people to buy, sell and trade the cryptocurrency."
2019-03-23,The Crypto 'Trichotomy',"The crypto space has split into three different areas, and the term “crypto” no longer applies to all of them, argues Tim Enneking."
2019-03-24,0,0
2019-03-24,How Lightning Makes Bitcoin Great Again (for Payments),Lightning Labs' Alex Bosworth talks about how the lightning network provides bitcoin's best hope for becoming the payments network of the future.
2019-03-24,Crypto Futures and Institutional Interest: Looking in the Wrong Place,"Cboe's suspension of bitcoin futures highlights a mistake we're all making when it comes to institutional involvement, argues Noelle Acheson."
2019-03-25,0,0
2019-03-25,'A Sad Joke': Bitcoin Cash's Lead Coder Quits Bitcoin Unlimited Project,"Amaury Séchet, a leading developer of bitcoin cash, is leaving one of the projects that paved the way for the controversial cryptocurrency."
2019-03-25,Bitcoin's Trading Range Narrows In March to Hit Two-Year Low,"Bitcoin's daily volatility in March, measured as the difference between 24-hour highs and lows, is its lowest since April of 2017."
2019-03-25,"A Bitcoin Lightning Web Standard, Inspired By Ethereum, Is Gaining Steam",0
2019-03-25,TrueDigital Expands Distribution of Its Bitcoin and Ether OTC Reference Rates,Institutional digital assets platform trueDigital has signed two new deals to expand the reach of its OTC reference rates for bitcoin and ether.
2019-03-25,"Bitcoin Price Consolidation Continues, Downside Break Looks Likely",Chart signals of bullish exhaustion suggest bitcoin's narrowing trading range could soon be breached to the downside.
2019-03-26,0,0
2019-03-26,Bitcoin Probes Key Price Support Below $3.9K After Range Breakdown,Bitcoin is on the defensive after a drop out of the recent trading range – now crucial support could turn into resistance.
2019-03-26,Amazon-Owned Twitch Removes Crypto Payments for Subscriptions,Amazon-owned live streaming video platform Twitch.tv has reportedly removed its cryptocurrency payment option for subscriptions.
2019-03-26,E-Commerce Giant Rakuten Wins License for New Crypto Exchange,Japan's Financial Service Agency has licensed a cryptocurrency exchange being rebranded and relaunched by internet giant Rakuten.
2019-03-26,From Law to Lawlessness: Bits of the Untold QuadrigaCX Story,"QuadrigaCX was once a well-run exchange but changed course overnight, writes a lawyer who represented the firm early on."
2019-03-26,Singapore-Based Crypto Exchange DragonEx Has Been Hacked,Singapore-based exchange DragonEx says it has been hacked for an undisclosed amount in a large number of cryptocurrencies.
2019-03-28,0,0
2019-03-28,Top Cap and Delta Cap: New Metrics for Spotting Bitcoin Price Trend Reversals,Cryptocurrency researchers Willy Woo and David Puell released several new valuation metrics for bitcoin's price in February. Here's an overview.
2019-03-28,Bitcoin Needs Price Gain for Bull Reversal in March,"A bull reversal would be confirmed if bitcoin closes March at levels above $4,190, price charts suggest."
2019-03-28,Fake Volume on Crypto Exchanges Isn't the Half of It,"There's more to add to Bitwise's recent report about fake trading volume across the crypto exchange industry, says Daniel Cawrey."
2019-03-28,Bitrefill Now Lets You Pay for Airbnb Rentals With 5 Cryptocurrencies,"Cryptocurrency gift card provider Bitrefill has added a service allowing users to book Airbnb rentals with bitcoin, ether and more."
2019-03-28,Crypto Startup TokenPay Buys Equity Stake in Heidi Klum Lingerie Maker,"TokenPay is turning ICO proceeds into equity investments, this time with a stake in lingerie company Naked Brand Group."
2019-03-29,0,0
2019-03-29,Canadian Municipality Set to Accept Bitcoin for Property Tax Payments,"The Town of Innisfil, Ontario, will accept bitcoin for property tax payments from next month in a one-year trial project."
2019-03-29,"SEC Postpones Decision on Bitwise, VanEck Bitcoin ETF Proposals","The SEC has extended its review period of the Bitwise bitcoin ETF proposal, filed in conjunction with NYSE Arca."
2019-03-29,Bitcoin Price Hits 5-Week High With Chart Echoing 2015 Pre-Rally Pattern,Bitcoin is slowly gaining altitude with a long-term lagging indicator flashing signs similar to those seen before the 2015 bull breakout.
2019-03-29,Bakkt Taps Former IBM and Cisco Exec Tom Noonan to Chair Its Board,"Bakkt has tapped Tom Noonan, a founder of multiple cybersecurity startups, to chair its new board."
2019-03-29,"'Big Four' Consulting Firms Dominate Blockchain Jobs Market, Says Indeed","Deloitte, KPMG and EY are all in the top five when it comes to posting blockchain and crypto job ads in the U.S., according to Indeed.com data."
2019-03-30,0,0
2019-03-30,The Ultimate Irony of Crypto Trading,"Dave Weisberger, CEO of CoinRoutes, looks at some of the main inefficiencies of crypto markets, and how investors can navigate them."
2019-03-30,Crypto Exchange Bithumb Hacked for $13 Million in Suspected Insider Job,"South Korean crypto exchange Bithumb has had over $13 million in EOS stolen in a hack, but says customer funds are safe."
2019-03-31,0,0
2019-03-31,Up 100%: Litecoin Price Sets Q1 Performance Record,Litecoin's price doubled in the first three months of 2019 to register its best first-quarter performance on record.
2019-04-01,0,0
2019-04-01,"Bitcoin Cash, Litecoin Futures Volumes Top $150 Million at Kraken Exchange",Kraken's Crypto Facilities has seen trading volumes in litecoin and bitcoin cash futures surge five-fold in recent weeks.
2019-04-01,Alt Season? Over 100 Crypto Assets Outperform Bitcoin in Q1 Surge,More than 100 cryptocurrencies outperformed bitcoin in what was the most bullish quarter the cryptocurrency market has seen since Q4 of 2017.
2019-04-01,Bitcoin Price Posts Biggest Quarterly Gain Since Late 2017,"Bitcoin made double-digit gains in the first three months of 2019, marking its best quarterly performance since Q4 2017."
2019-04-01,Coincheck Launches OTC Trading Service for Bitcoin,Japanese cryptocurrency exchange Coincheck has launched an over-the-counter bitcoin trading service aimed at clients with deep pockets.
2019-04-01,True Life: I'm a Bitcoin,What's it like to be bitcoin? It's not all it's hashed out to be.
2019-04-02,0,0
2019-04-02,"Bitcoin Price Jumps to 4-Month High Above $4,900","The price of bitcoin surged 7 percent within 30 minutes on Tuesday to reach over $4,900 – its highest point for 4 months."
2019-04-02,"Exchange Volumes May Be Fake, But Bitcoin's Value Is Real","More than a critique of price manipulation rife across bitcoin markets, the Bitwise report shows cryptocurrencies' potential."
2019-04-02,Bitcoin's Price Rises Above Major Moving Averages In First Since 2018,"Bitcoin is now trading above its 50, 100 and 200 day moving averages for the first time in nearly 15 months after the cryptocurrency breached $5,000 during Tuesday's trading s..."
2019-04-02,Sudden Bitcoin Price Breakout Sets New Bull Target at Over $5K,"After today's breakout, bitcoin now needs to move above crucial resistance near $5,200 to solidify the case for a longer-term bull market."
2019-04-02,Elon Musk Calls Dogecoin 'My Fav Cryptocurrency',"Weeks after calling bitcoin ""brilliant,"" Elon Musk has lauded one of the crypto market's oldest and silliest alternatives."
2019-04-03,0,0
2019-04-03,5-Star Swiss Hotel Set to Accept Bitcoin Payments,"The Dolder Grand, a five-star hotel in Switzerland, will start accepting bitcoin payments from next month."
2019-04-03,Jamaica Stock Exchange to Pilot Bitcoin and Ether Trading,The Jamaica Stock Exchange is soon to trial bitcoin and ether trades with help from Canadian fintech firm Blockstation.
2019-04-03,3 Reasons Bitcoin's Price Suddenly Surged Back to $5K,The cryptocurrency market sprang back to life with bitcoin's surge to 4.5-month highs yesterday. But why?
2019-04-03,This New Lightning App Aims to Make Getting Paid in Bitcoin Easier,A new service has launched to make it easier for people to accept money on bitcoin's lightning payments network.
2019-04-03,Atomic Capital Makes Crypto's Most Aggressive Lending Offer Yet,"Atomic Capital is offering to lend up to 85 percent of the value of clients' bitcoin or ether, at double-digit interest rates."
2019-04-04,0,0
2019-04-04,Bitcoin Faces Price Pullback Amid Extremely Overbought Conditions,Bitcoin could be in for a minor price retreat as the RSI is showing the most overbought conditions for 16 months.
2019-04-04,Canadian Court Rules Drug Dealer Must Hand Over $1.4 Million in Bitcoin,A Toronto judge has ruled that a 30-year old drug dealer must forfeit 281.41 bitcoins used in illegal activities on the dark web.
2019-04-04,The Biggest Winners from April's Early Crypto Market Rebound,Cryptocurrencies across the board are flashing significant growth in the first few days of April.
2019-04-04,"Coinbase, Paradigm Invest $15 Million in Startup Behind Disappearing Blockchain","Made by the startup O(1) Labs, the lightweight Coda protocol is adding more big-name investors to its cap table."
2019-04-04,Crypto Exchange Binance Is Setting Up Shop in Singapore This Month,"A Singapore fiat-to-crypto exchange launch, a DEX on the mainnet and token staking are all in the Binance news today."
2019-04-05,0,0
2019-04-05,Bitrefill's 'Thor Turbo' Lets You Get Started With Bitcoin's Lightning Faster,Bitcoin startup Bitrefill is launching a new service aimed at helping onboard users of the lightning network more quickly.
2019-04-05,Google Searches for 'Bitcoin' Hit Highest Total Since November,"Google searches for ""bitcoin"" jumped to its highest level on Tuesday since Nov. 20, 2018 as the cryptocurrency surged above $5,000 on most exchanges."
2019-04-05,10 Passes to Go: Bitcoin's Lightning Torch Will Soon Burn Out,"The globe-trotting bitcoin payments experiment is nearing its end, having attracted participants like Twitter CEO Jack Dorsey."
2019-04-05,Startup Behind Ethereum DEX Releases Lightning Developer Tools,"Radar Relay, a decentralized exchange for trading tokens over ethereum, is branching out into bitcoin lightning technology."
2019-04-05,Coinbase Tops JPMorgan in LinkedIn List of Most Popular Employers,Crypto exchange Coinbase has ranked above investment banking giant JPMorgan in LinkedIn’s top 50 U.S. employers list for 2019.
2019-04-06,0,0
2019-04-06,The Media's Cringeworthy Coverage of Bitcoin's Latest Price Surge,"From April Fools jokes to ""mystery"" orders fueling bitcoin's recent rally, mainstream media still struggles to get basic aspects of the crypto market."
2019-04-06,The Easiest Way to Send and Lose Bitcoin in 2012,Early bitcoin adopter Dan Gallancy talks about the trials and tribulations of giving away bitcoin.
2019-04-07,0,0
2019-04-07,"Even at $30, Bitcoin Was More Exciting Than Poker",Josh Rossi describes festive nights of playing poker with a who's who of the early bitcoin scene.
2019-04-07,Returns on Crypto Assets: The Hidden Message,"A look at the search for additional revenue streams from crypto investments, and what that says about the evolution of the asset class."
2019-04-08,0,0
2019-04-08,Next Bitcoin Core Release to Finally Connect Hardware Wallets to Full Nodes,"The coming release of Bitcoin Core will finally, natively allow users to connect bitcoin full nodes to hardware wallets."
2019-04-08,Bitcoin Price Leaps Resistance Hurdle in Weekend Breakout,"Bitcoin’s breakout from $5,050 resistance has defied overbought indicators and set a new target of $5,550 for the bulls."
2019-04-08,"Sparkswap Raises $3.5 Million From Initialized, Pantera for Lightning-Powered DEX",Pantera-backed Sparkswap has launched to offer pro traders litecoin-to-bitcoin atomic swaps using the lightning network.
2019-04-08,Crypto Market Capitalization Hits 5-Month High Above $185 Billion,"The combined value of the cryptocurrency market rose to $185.89 billion earlier today, its highest level since Nov. 18."
2019-04-08,"Coinbase Pro Lists EOS, Augur's REP and MakerDAO's MKR Tokens","EOS, MKR and REP will become fully available for trading sometime Tuesday on Coinbase's professional platform."
2019-04-09,0,0
2019-04-09,Bitcoin's 'Super Guppy' Price Indicator Flips Bullish in First Since 2018,"Several bitcoin price indicators have turned positive on the charts, strongly suggesting bullish momentum is growing."
2019-04-09,Bitcoin Trader Ordered to Forfeit $800K Gained via Unlicensed Exchange,"A 22-year-old bitcoin dealer from the U.S. has been ordered to hand over $823,357 gained illegally via an unlicensed money transmission business."
2019-04-09,China's Economic Planning Body Labels Bitcoin Mining an 'Undesirable' Industry,"A Chinese government agency in charge of macroeconomic policies is labeling bitcoin mining as an ""undesirable"" industry in a draft economic proposal."
2019-04-09,"Advocate for Mt Gox Creditors Quits, Saying Bitcoin Payouts Could Take Years",The head of a large Mt. Gox creditor group is stepping down amid what he described as a legal quagmire that could take years to resolve.
2019-04-09,"Bitstamp Granted BitLicense, Will Expand Crypto Services in US","Europe-based crypto exchange Bitstamp has just received New York's 19th BitLicense, allowing it to offer five crypto trading pairs in the state."
2019-04-10,0,0
2019-04-10,"This Bitcoin Price Pattern Suggests $5,800 Potential Ahead","Bitcoin is trending inside an ascending triangle pattern on the hourly chart that brings potential for a move to over $5,880, analysis suggests."
2019-04-10,Coinbase Launches Crypto Visa Debit Card for UK and EU Customers,Coinbase has launched a Visa debit card allowing U.K. and EU users to spend crypto directly from their exchange accounts.
2019-04-10,$60 Million and Rising: China's Crypto Funds Try Lending to Beat Bear Market,"Investors such as Bixin Capital, FBG Capital and Dong Zhao’s DGroup have been lending tens of millions of dollars in crypto since the fall."
2019-04-10,Christine Lagarde Pits Circle Against JPMorgan in IMF Debate,"Decentralized systems are coming for the banks, argued Circle CEO Jeremy Allaire, in a panel Wednesday at the International Monetary Fund."
2019-04-10,New York Rejects Bittrex Exchange's BitLicense Application,"NYDFS has rejected Bittrex's application for a BitLicense, citing ""inadequate"" AML compliance among other reasons."
2019-04-11,0,0
2019-04-11,Bitcoin Drops Back to $5K Price Support After Failed Breakout,"Bitcoin has fallen back close to psychological support at $5,000 after a failed breakout Wednesday."
2019-04-11,"Bitcoin Futures Exchange Bakkt Hires PayPal, Google Vet as Product Chief",Bitcoin futures platform Bakkt has brought Google Wallet and PayPal vet Mike Blandina as its chief product officer.
2019-04-11,'Crypto Stripe' Flexa Raises $14 Million So You Can Buy Coffee With Bitcoin,Payments startup Flexa is using funds from a private token sale to make shopping with bitcoin at brick-and-mortar stores a reality.
2019-04-11,China's New Policy Isn't An Automatic Bitcoin Mining Ban – Here's Why,"Despite breathless headlines, a recent proposal by China’s economic planners would not automatically ban bitcoin mining."
2019-04-11,Pennsylvania's State-Backed VC Firm Is Tokenizing an Investment Fund,"Ben Franklin Technology Partners, a Pennsylvania-funded VC provider, is tokenizing shares in one of its funds."
2019-04-12,0,0
2019-04-12,"Bitcoin Defends Psychological Support Line After Price Dip to $4,900","Bitcoin dropped to around $4,900 earlier today, but has since fought back to above the $5K psychological support line."
2019-04-12,Zooko Wilcox Envisions 'Ambitious' Changes for Zcash Cryptocurrency,"Founder and CEO of the Electric Coin Company Zooko Wilcox envisions zcash to change radically over the next five years, starting with ""an ambitious scalability improvement."""
2019-04-13,0,0
2019-04-13,The Upside of Bitcoin's Upside (It’s Not What You Think),"While price appreciation is always good for an asset class, in the case of cryptocurrencies the benefits go way beyond profit."
2019-04-14,0,0
2019-04-15,0,0
2019-04-15,The Bigger Picture Behind Bitcoin's Latest Price Rebound,"Bitcoin's latest rebound above $5,000 isn't about new investors, it's a reaffirmation of its real strength as a resistant global network."
2019-04-15,'Satoshi's Treasure' Is a Global Puzzle With a $1 Million Bitcoin Prize,"This treasure hunt is like a bitcoin version of ""Ready Player One,"" with the first clues released via Blockstream's satellite."
