Date,Title,Description
2019-01-01,0,0
2019-01-02,0,0
2019-01-02,"Down More than 70% in 2018, Bitcoin Closes Its Worst Year on Record","Bitcoin's price just finished its worst performing year ever, closing 2018 at a more than 70 percent lower price than its yearly open."
2019-01-02,Bitcoin Price Suffers Worst Monthly Losing Streak in 7 Years,"Bitcoin fell for the fifth month in a row in December, confirming its longest monthly losing streak since November 2011."
2019-01-02,E-Commerce Giant DMM Quits Cryptocurrency Mining Business,Japanese e-commerce giant DMM.com is in the process of winding down its cryptocurrency mining business due to the crypto market slump.
2019-01-02,The Secret for a $1 Trillion Crypto Market? Keep Building,"Sure, the crypto market boom of 2017 exposed the industry's lack of infrastructure. That just means the solution is clear – we must build it and keep building."
2019-01-03,0,0
2019-01-03,Overstock Will Pay Some of Its 2019 Taxes in Bitcoin,Overstock.com plans to be the first major business to pay state taxes using bitcoin in Ohio.
2019-01-03,Proof of Keys Explained: Bitcoin’s First Planned ‘Bank Run’ Is Today,"Participants in the ""Proof of Keys"" movement will be taking their money out of third-party bitcoin services, moving it to accounts only they control."
2019-01-03,Bitcoin Eyes Test of Key Price Hurdle in First Since November,Bitcoin looks set to test the crucial 50-day simple moving average (SMA) for the first time since November 8.
2019-01-03,7 Legal Questions That Will Define Blockchain in 2019,"In this exclusive op-ed, Jenny Leung, an Australian attorney who formerly worked for the country's financial regulator, explained 7 legal questions that will define blockchain..."
2019-01-03,"How to Last the Crypto Winter? Seek Simplicity, Manage Complexity",Decred's Jake Yocom-Piatt explains in this exclusive op-ed why he thinks information asymmetry is a key factor driving the manic buying and panic selling cycles in the crypto...
2019-01-04,0,0
2019-01-04,$4K Ahead? Bitcoin's Low-Volume Price Pullback Could Be a Bear Trap,"Bitcoin's recent pullback from highs above $4,200 could trap the bears on the wrong side of the market, the price-volume analysis indicates."
2019-01-04,The Map Is Not the Territory: Rethinking Crypto as an Asset Class,Crypto as an asset class? Investors would do well to learn it's not a one-size-fits all classification.
2019-01-04,Ethereum Developers Give 'Tentative' Greenlight to ASIC-Blocking Code,A 'tentative' consensus was reached today that ethereum's developers will propose blocking ASIC before the blockchain's proof-of-stake upgrade.
2019-01-05,0,0
2019-01-05,"Bitcoin Payments Aren't Dead, They've Just Gone Niche",Accepting crypto payments can help niche businesses build deeper relationships with customers – as this real-world example shows.
2019-01-05,2018: When Privacy and Decentralization Collided,"In an op-ed written exclusively for CoinDesk, Enigma CEO Guy Zyskind says 2019 must be about building decentralized solutions for data privacy."
2019-01-06,0,0
2019-01-06,RIP ICOs: 2019 Will Be the Year of Enterprise Blockchain Tokens,"In 2019, tokens will invade the enterprise in full force and the line between public and private networks will start to disappear, writes ConsenSys' Ajit Tripathi."
2019-01-06,"The Biggest Problem for ICOs? In 2018, It Was Their Own Investors","Hashed CEO Simon Seojoon Kim looks at the inherent limitations of ICOs, in particular the belief that ""anyone can invest in an initial project."""
2019-01-07,0,0
2019-01-07,Back Above $4K: Bitcoin's Price Hits a Two-Week High,"The price of bitcoin is trading above $4,000, its highest level in two weeks, a move that was backed by strong volume."
2019-01-07,The Coming Bifurcation of Bitcoin,Two particularly important ideas related to bitcoin's future are likely going to conflict with each other. But that doesn't need to a problem.
2019-01-07,Breakout Ahead? Bitcoin Closes on Key Price Hurdle,"Bitcoin's bears would be put on the back foot if prices climb past key resistance lined up at $4,140."
2019-01-07,Ethereum Classic's Price Stumbles Amid Suspected 51% Attack,The price of ethereum classic is pulling back as a result of a recently reported attack that resulted in a series of blockchain history rewrites.
2019-01-07,Japan's Financial Regulator May Approve Crypto ETFs: Report,"Japan’s Financial Services Agency is considering the approval of crypto exchange-traded funds (ETFs), according to a Bloomberg source."
2019-01-08,0,0
2019-01-08,Bitcoin Miner Maker Canaan Considering New York IPO: Report,"China-based Canaan, the second largest manufacturer of bitcoin mining devices, is considering an IPO in the U.S., according to Bloomberg."
2019-01-08,Looking North? Bitcoin Price Dip Forms Bull Flag Pattern,"Bitcoin's minor pullback from two-week highs could end up fueling a breakout above the key hurdle of $4,140."
2019-01-08,Ether Markets Are Mimicking Bitcoin's 2015 Price Bottom,"Ether's bitcoin market (ETH/BTC) is mimicking the structure of bitcoin's bear market bottom in 2015, leaving some to wonder if a long term bottom is being printed."
2019-01-08,Africa Needs Open Currency Competition. It Needs Cryptocurrency,"Africa's various currency crises illustrate why cryptocurrency innovation shouldn't be stifled, says economic analyst Terence Zimwara."
2019-01-08,"Crypto Derivatives Exchange Spins Off From Coinfloor, Plans Stablecoin Futures","CoinfloorEX, a bitcoin futures market, has been spun off from its parent company and will relaunch next month with a stablecoin futures product."
2019-01-09,0,0
2019-01-09,Bullish Sentiment for Bitcoin Is at a 5-Month High,The difference between long and short positions placed on bitcoin is at its highest level since Aug. 5.
2019-01-09,Bitcoin Price Faces Minor Pullback as Indecision Creeps into Market,"With the bitcoin market showing signs of indecision, prices could soon retreat back below $4,000."
2019-01-09,The Case for a 2020 Bitcoin Bull Run,"In this educational op-ed, Pugilist Ventures' founder Christopher Brookins explains his main takeaways from the recent crypto market decline."
2019-01-09,Bitcoin At 10: Bitcoin Regrets – The Next Chapter in CoinDesk's Interactive Series,0
2019-01-09,New Bitrefill Service Aims to Make Lightning Payments Easy,Now bitcoin users can send someone a lightning payment without the hassle of setting up channels.
2019-01-10,0,0
2019-01-10,Bitcoin Price Tumbles 10% as Crypto Markets Flash Red,The price of bitcoin fell more than 10 percent during Thursday's trading session as it erased much of its recent gains.
2019-01-10,Bitwise Files for New Bitcoin ETF With SEC,Bitwise Asset Management is planning a new effort at launching a bitcoin exchange-traded fund with NYSE Arca.
2019-01-10,Bitcoin Price Slips Below $3.8K as Bullish Bets Tank,Bitcoin is losing altitude as an unwinding of bullish bets is creating downward pressure on prices.
2019-01-10,"Crypto Mining Malware Has Netted Nearly 5% of All Monero, Says Research","Hackers have mined at least 4.32 percent of the total monero in circulation, worth nearly $40 million today, according to new research."
2019-01-10,Lawyers Rush In: New UNH Blockchain Program Nabs Big-Name Speakers,"“A crypto winter for the price is a crypto summer for attorneys."" And University of New Hampshire Law School is now addressing that demand."
2019-01-11,0,0
2019-01-11,Google Policy Change Forces Bitcoin Wallet to Remove Security Features,"Privacy-focused bitcoin wallet Samourai said Google's ""extremely restrictive policies"" forced exclusion of key security and privacy focused features from its application."
2019-01-11,Bitcoin Price Looks South After Worst Daily Loss Since November,"Bitcoin’s price saw its biggest drop for seven weeks on Thursday, weakening the prospects of a bullish breakout above $4,100."
2019-01-11,Coincheck Wins Crypto Exchange License 12 Months After Major Hack,"Japanese crypto exchange Coincheck, which suffered a $530 million hack in January of last year, is now a licensed entity."
2019-01-11,'0% Success': Why Blockchain Apps Just Aren’t Taking Off,"In 2018, the promise of a decentralized future took a big knock. There are lessons to be learned, says Yin Wu, founder of Dirt Protocol."
2019-01-11,New York City Economic Corp Launches Blockchain Education Center,The New York City Economic Development Corporation has launched a new blockchain education center.
2019-01-12,0,0
2019-01-12,I'm As Certain As Ever – Bitcoin's Revolution Is Only Just Beginning,"I’ve been through the ups and downs with bitcoin, and I am as certain as ever that the bitcoin revolution is coming, says Tim Draper."
2019-01-12,Web 3.0's Crypto Winter Mission: Keep Our Heads Above the Hype,"Despite the gloomy narratives, 2018 was hugely productive for teams building the decentralized web, says Parity's Jutta Steiner."
2019-01-13,0,0
2019-01-13,Bitcoin Will Still Bite the Dust,"Economic professor Kevin Dowd argues that bitcoin is like the Ford Model T and, while innovative, cannot survive in the long term."
2019-01-13,This Scaling Tech Could Let You Sync Bitcoin Straight From Your Phone,"A new approach to storing bitcoin's ""state"" could help significantly reduce storage requirements for users of the cryptocurrency."
2019-01-14,0,0
2019-01-14,LedgerX Launches 'Bitcoin Fear Index' to Track Price Volatility,"LedgerX is launching LXVX – a ""Bitcoin Fear Index"" similar to the VIX, a popular volatility benchmark in the stock market."
2019-01-14,Bitcoin Futures Market Bakkt Makes Its First Acquisition,"Bakkt acquired parts of Rosenthal Collins Group, an independent futures commission, to build up its risk management and regulatory compliance procedures."
2019-01-14,Bitcoin Risks Return to December Lows After Price Drop to $3.5K,"After breaching key support on Sunday, emboldened bears could soon push bitcoin prices back towards $3,100."
2019-01-14,How the US Government Shutdown Is Halting Crypto Progress on Wall Street,A record-breaking government shutdown in the U.S. is pushing crypto policy decisions to the back burner.
2019-01-14,The Ethereum Classic Attacker Has Sent a Bigger Message,"If a permissionless blockchain doesn’t have a large enough community of users, developers and miners, its vulnerable, writes Michael J. Casey."
2019-01-15,0,0
2019-01-15,Bitcoin Futures Now Trading At Discount to Exchange Prices,"Bitcoin futures are trading below the cryptocurrency's spot price, signaling market participants have a bearish outlook on bitcoin over the coming months."
2019-01-15,This Price Resistance Level May Hold Key to Bitcoin Bull Market,"If bitcoin breaks above a key moving average, it could be considered a sign a bearish-to-bullish trend change has begun."
2019-01-15,The 'Thirdening' Approaches: How to Watch Ethereum's Fork as It Happens,"The world’s third largest blockchain by total value, ethereum, is about to upgrade its code. Here's how you can watch the event live."
2019-01-15,European Blockchain Startup Launches Trading in Tokenized Securities,Belarus-based blockchain startup Currency.com has launched a trading platform for tokenized securities.
2019-01-16,0,0
2019-01-16,Will Bitcoin's Price Extend Its Four-Year January Losing Streak?,"Bitcoin has reported losses in January for the last four years, and a fifth now looks on the cards."
2019-01-16,Bankrupt Bitcoin Miner Giga Watt Forced to Cease Daily Operations,Bankrupt bitcoin mining firm Giga Watt has said it's shutting down operations after its power was cut and facility access was blocked.
2019-01-16,Bitwage Now Lets Firms Pay Salaried Staff in Crypto,A new product from Bitwage makes it easier to handle payroll taxes when paying employees in bitcoin or ether.
2019-01-16,"Genesis, BitGo Team Up to Ease Crypto Trading for Institutions",BitGo and Genesis Global Trading are targeting Wall Street institutions with a new high-speed crypto trading service.
2019-01-16,Grin Mining Launch Draws Interest From Deep-Pocketed Investors,Investment firms joined the fray in yesterday's launch of the privacy-focused cryptocurrency known as Grin.
2019-01-17,0,0
2019-01-17,"One Year Later, What's Holding Back SegWit Adoption on Bitcoin?",SegWit was activated on the bitcoin network over a year ago. But only an estimated 36 percent of all bitcoin transactions are using it. Why?
2019-01-17,Bitcoin Price Volatility Is Down 98% Year-on-Year,Bitcoin's daily price volatility has plummeted in the last 12 months as the bear market killed off the speculative frenzy.
2019-01-17,BitPay Says It Processed Over $1 Billion in Crypto Payments Last Year,U.S.-based crypto payments processor BitPay says it processed over $1 billion-worth of transactions last year.
2019-01-17,Ethereum Co-Founder Joe Lubin Joins Board of Crypto Futures Platform ErisX,"ErisX is expanding its board as it prepares to launch spot and derivatives markets for bitcoin and, eventually, ethereum."
2019-01-17,ConsenSys Invests in Two Crypto Startups to Lead VCs Into Ethereum Ecosystem,ConsenSys just invested $1 million in crypto trading platform Coinhouse and an undisclosed amount in privacy-centric browser Tenta. It's part of a broader strategy.
2019-01-18,0,0
2019-01-18,You Can Now Buy Bitcoin at Some Grocery Stores in the US,"Supermarket kiosk chain Coinstar will allow consumers to buy up to $2,500 in bitcoin at select grocery stores."
2019-01-18,Bitcoin Price Consolidation May Have Weakened Bear Case,"Bitcoin's eight-day stretch of consolidation looks to have weakened the prospects of a drop back to December lows near $3,100."
2019-01-18,Thai Stock Exchange Plans to Launch a Token Trading Platform,The Stock Exchange of Thailand is looking to capitalize on investor interest in cryptos by offering a new digital assets exchange.
2019-01-18,Grayscale's Newest Crypto Investment Trust Will Hold Stellar Lumens,"Grayscale Investments is launching a new single-asset trust for Stellar lumens, allowing accredited investors to gain exposure to the cryptocurrency."
2019-01-19,0,0
2019-01-19,Why 'Mainstream Adoption' Is an Unfair Success Metric for Dapps,"We are way too early for “mainstream adoption” to be a sensible success metric for dapps, says Coleman Maher."
2019-01-20,0,0
2019-01-21,0,0
2019-01-21,South Korean Exchange Loses $5 Million in Accidental Bitcoin Airdrop,South Korean exchange Coinzest reportedly lost around $5 million when it airdropped bitcoin and other cryptocurrencies instead of WGT.
2019-01-21,This Former Bitcoin Price Support Is Now Capping Gains,Bitcoin's weekly gains were wiped out at the weekend at a key moving average that previously offered support.
2019-01-21,Digital Garage to Test Yen-Pegged Stablecoin on Blockstream Network,A Digital Garage subsidiary has partnered with blockchain tech firm Blockstream to test atomic swaps of a Japanese yen-pegged stablecoin.
2019-01-21,Proof-of-Stake Could Lead to Crypto Banking. Let's Avoid That,"""Staking as a service"" is taking off. We need to think hard about what this means for crypto's evolution, warns Michael J. Casey."
2019-01-21,Crypto CEO Sentenced to 3-Year Jail Term for Faking Trading Volume,Two execs from South Korean crypto exchange Komid have been given jail time for faking trading volume and deceiving investors.
2019-01-22,0,0
2019-01-22,"Bitcoin's Proof-of-Work Algorithm Needs Replacing, Argues BIS Study","The proof-of-work algorithm used by bitcoin and some other cryptos is not viable in the long term, argues a Bank for International Settlements study."
2019-01-22,"Bitcoin's Price Counters the VIX, Confirming It's Still a Risk Asset","Bitcoin's price inversely correlates with the CBOE Volatility Index (VIX), meaning the premier cryptocurrency is still a risk-asset and not a safe haven."
2019-01-22,Bakkt Makes Initial Hiring Push for Bitcoin Futures Exchange,The hotly anticipated bitcoin futures platform plans to hire at least eight individuals in areas from sales to tech to finance.
2019-01-22,Bitcoin Sees Longest Stretch of Price Consolidation Since October,Bitcoin is witnessing the longest stretch of range-bound price activity in three months.
2019-01-22,Bitfury Hires a CEO for Its Blockchain-Sleuthing Service,"Bitfury has hired a CEO for Crystal, its service that examines public blockchains for criminal transactions, and a head of software sales."
2019-01-23,0,0
2019-01-23,Cboe Exchange Withdraws Proposal for VanEck-SolidX Bitcoin ETF,"Cboe has withdrawn its hoped-for bitcoin ETF proposal, which faced a final deadline of Feb. 27 for approval."
2019-01-23,"Bitfury Releases Merchant, Developer Tools for Bitcoin's Lighting Network",Blockchain technology firm Bitfury has released a suite tools aimed to drive adoption of bitcoin’s lightning network.
2019-01-23,"US Government Shutdown Derailed Bitcoin ETF Talks, Says VanEck CEO","The bitcoin ETF proposal was pulled due to the government shutdown, VanEck CEO Jan van Eck said Wednesday."
2019-01-23,Seed CX Launches Spot Bitcoin Trading in Bid for Big-Money Investors,Chicago-based Seed CX has launched a bitcoin spot trading market for its major clients.
2019-01-23,Gold Price May Offer Clues About Next Big Bitcoin Move,Bitcoin traders could get cues from an apparent negative correlation that has developed between bitcoin and gold prices.
2019-01-24,0,0
2019-01-24,Bitcoin Price Defends $3.5K After Cboe Pulls ETF Proposal,"With bitcoin showing resilience to negative news flow, a strong bullish move is looking increasingly likely."
2019-01-24,"Robinhood, LibertyX Receive Licenses from New York Regulators","The New York Department of Financial Services granted Robinhood and LibertyX BitLicenses on Thursday, bringing them into a select group of less than 20 firms to have such appr..."
2019-01-24,Crypto Markets Unfazed by Latest ETF Withdrawal,The cryptocurrency markets are so far stable after Cbeo withdrew its ETF proposal with the SEC on Wednesday.
2019-01-24,Coinbase Integrates TurboTax to Help US Clients File Crypto Taxes,TurboTax is partnering with Coinbase and four other crypto startups to help U.S. investors properly file their taxes for 2018.
2019-01-24,Tron CEO Justin Sun Wants to Hire You to Organize His House,"Token-funded blockchain project Tron is not only hiring while others cut staff, it's recruiting an entourage for its founder."
2019-01-25,0,0
2019-01-25,"Bitcoin ATM Startups Say They're Booming, Thanks in Part to Venezuela","Bitcoin ATM usage is surging, especially in Latin America, where Venezuelan refugees and others are seeking ad hoc banking solutions."
2019-01-25,"When Bitcoin ETF? Not Any Time Soon, But Maybe by 2020","There are no bitcoin ETF proposals currently sitting before the SEC, but one may still be approved before 2020."
2019-01-25,NYSE Arca Files Paperwork for Bitwise Bitcoin ETF Approval,A little-noticed regulatory filing sheds light on the bitcoin ETF proposed by Bitwise and NYSE Arca.
2019-01-25,Bitcoin Awaits Triangle Breakout as Price Squeeze Continues,Bitcoin’s price is largely unchanged on the day and maybe building for a strong exit from the weeks-long period of consolidation.
2019-01-26,0,0
2019-01-26,Stranger Things: The Upside of Down Bitcoin Prices,"The bitcoin price correction of 2018 should actually help force the market as a whole to mature in 2019, writes the CEO of Seed CX."
2019-01-27,0,0
2019-01-27,State of Lightning: What's the Path for Network Adoption in 2019?,"The ""instant payments"" network running atop bitcoin saw fast user adoption levels in 2018. Will the trend continue this year?"
2019-01-28,0,0
2019-01-28,Bitcoin Price Looks South After Drop to Six-Week Lows,Bitcoin ended a two-week period of consolidation with a drop to six-week lows earlier today.
2019-01-28,Cryptos Would Only Have Value in 'Dystopian' Economy: JPMorgan,JPMorgan Chase has said that cryptocurrencies would only have value when confidence in traditional assets had been lost.
2019-01-28,Ex-Starbucks CEO and Presidential Hopeful Howard Schultz Is a Crypto Fan,"Howard Schultz, who may run for president of the U.S., is a firm believer in cryptocurrencies and blockchain technology."
2019-01-28,LocalBitcoins Reveals Security Breach With Some Crypto Wallets Affected,Peer-to-peer bitcoin trading site LocalBitcoins says it's suffered a hack via a third-party service that affected a small number of users.
2019-01-28,Crypto Startup Wants You to Trade on Exchanges Without Trusting Them,"The Arwen protocol, launched on testnet Monday, aims to let centralized exchange users self-custody their private keys and conduct transactions off-chain."
2019-01-29,0,0
2019-01-29,"Iran Could Ban Bitcoin for Payments, Central Bank Report Suggests",The Iranian central bank has drafted a new report outlining cryptocurrency regulations in the country.
2019-01-29,Down Again: Bitcoin Is Closing on Key Long-Term Price Support,"Bitcoin is on the defensive after a drop to six-week lows and could soon test crucial long-term support below $3,300."
2019-01-29,TokenSoft Launches Crypto Custody Service for Security Tokens,TokenSoft is rolling out what it bills as the first cold-storage multi-signature wallet designed specifically for security tokens.
2019-01-29,Fidelity May Formally Launch Its Crypto Custody Service in March,"The storage component of Fidelity Digital Asset Services (FDAS) is already live, with some assets under management."
2019-01-29,"From Mar-a-Lago to Coinbase, Dubious Claims Follow Doc.com Token Sales",A CoinDesk investigation reveals that health startup Doc.com has used overstated claims to gin up investor demand.
2019-01-30,0,0
2019-01-30,This Spongebob-Themed Tech Proves That Bitcoin's Lightning Is Advancing,"Spongebob Squarepants term ""wumbo"" has been appropriated to describe one of the next milestones for bitcoin's lightning network."
2019-01-30,Bitcoin Eyes Minor Price Bounce But Bear Trend Intact,"Bitcoin has recovered slightly from six-week lows seen yesterday and could see a short-term corrective bounce to $3,500."
2019-01-30,We Asked 66 Startups Just How Bad This Crypto Winter Has Been,"While the bear market has sparked layoffs at some firms, a survey conducted by CoinDesk found that many companies find the slowdown to be ""a blessing."""
2019-01-30,Crypto Lender Genesis Capital Processed Nearly $1.1 Billion In 2018,Institutional crypto loans provider Genesis Global Capital says it processed more than $1.1 billion in lends and borrows in 2018.
2019-01-31,0,0
2019-01-31,NYDFS Grants BitLicense to Third Bitcoin ATM Operator,"NYDFS has granted a third bitcoin ATM operator a BitLicense Thursday, with Cottonwood Vending LLC becoming the latest recipient."
2019-01-31,"February Is Often Good for Bitcoin Prices, Will History Repeat in 2019?",Bitcoin could end its four-year February winning streak unless prices see a strong bounce from key support.
2019-01-31,Cboe Resubmits the VanEck/SolidX Bitcoin ETF Proposal for SEC Approval,"Cboe has re-filed the VanEck/SolidX bitcoin ETF proposal, which it previously withdrew due to the U.S. government shutdown."
2019-01-31,A Bitcoin-Backed Stablecoin Has Launched on the Ethereum Blockchain,"Wrapped BTC (WBTC), an ERC-20 ethereum token collateralized 1-to-1 with bitcoin, is officially live, with about $250,000 worth in circulation."
2019-01-31,Binance Users Can Now Pay for Crypto With Credit Cards,Top crypto exchange Binance now lets customers purchase some cryptocurrencies using Visa and Mastercard credit cards.
2019-02-01,0,0
2019-02-01,Casa's Lightning-Enabled Bitcoin Node Just Got a Browser Extension,Cryptocurrency custody startup Casa has launched a browser extension for direct control of its lightning network-enabled bitcoin node.
2019-02-01,Bitcoin Price Hits Record Sixth Consecutive Month of Losses,"Bitcoin's price fell for a record sixth consecutive month in January, after an early bounce to $4,000 failed to entice mass buying."
2019-02-01,Wall Street Crypto Products May Have to Wait as US Regulators Confront Backlog,"The SEC and CFTC have five weeks of work to catch up on, and crypto advocates have no illusions that bitcoin ETFs and the like are a priority."
2019-02-01,Coinbase's Director of Data Science and Risk Leaves to 'Build From Scratch',"Soups Ranjan, who worked at Coinbase since 2015 as director of data analysis and fraud prevention, has left the crypto exchange to start something new."
2019-02-01,SatoshiPay Integrates Blockchain Payments for Major European Publisher,Micropayments startup SatoshiPay has partnered with Europe's largest digital publisher to integrate blockchain payments for content.
2019-02-02,0,0
2019-02-02,Bitcoin Is Now Officially In Its Longest Bear Market Ever,Bitcoin's price has officially continued to print lower price highs for the longest amount of time in the cryptocurrency's 10 year history.
2019-02-02,The History of HODL,"“HODL,” one of the most frequently used terms in the cryptocurrency world, originated years ago from a typo."
2019-02-02,Don't Believe the FUD: Ethereum Can Scale,The narrative that ethereum can't scale is being actively disproved in production environments on a daily basis.
2019-02-03,0,0
2019-02-03,Token Issuers Must Stop Paying for Market Making,"It's time for the crypto world to adopt the best practices of the traditional public securities exchanges, including rules on ethics and fair dealing."
2019-02-04,0,0
2019-02-04,Bitfury Partners to Launch Bitcoin Mining Centers in Paraguay,"Bitfury has teamed up with a South Korean firm to mine bitcoin using cheap, clean hydro power in Paraguay."
2019-02-04,Bitcoin Price Charts Offer Glimmer of Hope to Struggling Bulls,The slow drip bitcoin price sell-off seen over the last six weeks has produced a bullish pattern on the daily chart.
2019-02-04,BitTorrent Token Is Already Nearly 6 Times Its ICO Price,The price of BitTorrent Token (BTT) is up nearly 600 percent from its Initial Coin Offering (ICO) which took place just one week ago.
